name,description,0,1,2,3,4,5,6
二坑隧道,新北市鶯歌區規劃的登山步道總共有十八條之多，適合愛登山健行的人，二坑隧道位在孫龍步道途中的鶯石亭附近，以前是輕便車路(運煤鐵路)，供載運煤礦來往附近已封坑多年的五益煤礦二坑。這條小隧道所在的輕便車路段，原本是一處彎度比較大的彎道。後來相關單位為顧及安全，遂截彎取直，開鑿這段小隧道。由於二坑隧道是鶯歌山區唯一的小隧道，長度僅約有十公尺，寬度也僅五公尺，屬於比較少見的迷你型隧道，常引起登山民眾好奇觀看或拍照留念。,0,0,1,0,0,0,0
大尖山風景區,標高460公尺的大尖山，因秀麗的景致成為汐止群山中著名的郊山，堪稱為汐止後花園，大尖山隨季節更替，變幻著不同風情，初春山櫻花綻放，夏天螢火蟲點點發光，秋末楓葉染紅山頭，而周邊瀑布群水量豐沛，如大尖山瀑布、茄苳瀑布、秀峰瀑布等也很有看頭，是個靜謐又可享受大自然芬多精的悠然勝地！大尖山風景區有許多條登山步道，長短與難度各不相同，從天秀宮或天道清修院兩處登山口，沿著石階步道上山，因先天的地理優勢，這裡能居高臨下，全覽大臺北盆地，壯闊市景盡收眼底，周圍山巒層層疊疊、濃淡有致，宛如潑墨山水畫，夜晚可看到萬家燈火的景象，獨享超過 180 度的絢爛夜景。除此之外，這裡更是欣賞臺北101大樓跨年煙火的絕佳景點。,0,0,1,0,0,0,0
烏來紅河谷,烏來紅河谷位在加九寮溪及南勢溪的交會處，溪水沁涼透澈，乾淨無汙染，可見魚蝦在水中自在悠遊，從紅色的加九寮景觀大橋上俯瞰，可見各式奇形怪狀的高大巨石，與碧綠的溪流相映成趣，如此壯闊的溪谷景觀，讓紅河谷擁有「小太魯閣」美譽。位在烏來區的紅河，舊稱「加九寮」，由於南勢溪流經此地，形成一個大彎，在受到切割與擠壓的作用下，造就溪畔的岩石傾斜45度，加上旁邊一條支流襲奪，形成一大片岩層傾斜的河床，彷彿一幅幅巧奪天工的壯麗畫作，總讓旅人忍不住駐足停留欣賞一會。除了觀賞紅河谷壯觀的地景之外，不妨順路拜訪平坦的加九寮步道，加九寮步道為昔日運送木材之台車道所改建，全長2.1公里，終點至烏來觀光大橋，全程路況平緩，步道兩旁綠樹成蔭，擁有鳳蝶、青帶鳳蝶、小樹蛙及筆筒樹等豐富的自然生態，適合倘佯其中享受大自然的擁抱。步道長度：2.1公里海拔高度：145~155公尺路面狀況：原始山徑步行時間：1-1.5小時,0,0,1,0,0,0,0
炮子崙瀑布,炮子崙瀑布位於炮子崙溪上，溪水豐沛時有四道水柱由瀑頂灌下，又稱四龍瀑布。由於深坑山林蓊鬱，大小溪流蜿蜒遍佈，山河之間處處皆有天成美景，其中即以四龍瀑布最為著名。欲前往四龍瀑布可由大團園休閒農園左後方通往文山高爾夫球練習場之道路前行，途經炮子崙農家，沿溪溝下行約25分鐘至山谷即可到達，這入口非常不起眼，若沒注意真的會錯過。,0,0,1,0,0,0,0
格頭雲瀑,本地因為四周群山環繞，當太陽照射時，積存在樹林間的水氣就蒸發成雲霧，像一堆白色的浪花在青山間翻騰，形成雲海景觀。本地欣賞雲海的地方很多，其中以位於北宜公路上的小格頭一帶最為出名。由小格頭向北望玉桂嶺等山，山巒突出雲層之上，只要天氣稍有變化，整個山巒就沉入雲海之中，好不壯觀。與臺灣其他觀賞雲海之景點相較，海拔低與出現頻率高是其特色。,0,0,1,0,0,0,0
硬漢嶺,硬漢嶺登山步道，為昔稱觀音古道，海拔616公尺，是觀音山的最高山峰，昔日憲兵學校曾在此訓練「硬漢精神」而得名。硬漢嶺坡度為14.87%，坡度較陡，屬於二級坡，單程距離約1563公尺，大多為石階，緩步慢行需要至少60分鐘，才能抵達步道頂端硬漢嶺，因此被分類為「鍛鍊級」步道，適合經常登山健行或者體力較佳者行走。經凌雲禪寺旁步道入口前往，步道沿山勢蜿蜒拾級而上，途中可觀賞火山地形與巨石熔岩群，兩旁栽植山茶、杜鵑和櫻花，每逢花季更添旅遊樂趣。登上硬漢嶺後，居高臨下，視野遼闊，可以遠眺淡水河入海口、101大樓、新光大樓、圓山飯店、關渡大橋、淡水、八里等大台北地區美麗景緻與觀音山周邊秀麗的十八連峰，美景一覽無遺，盡收眼底。,0,0,1,0,0,0,0
皇帝殿登山步道,皇帝殿登山步道位於新北市石碇區，是雪山山脈向北延伸而來的山稜，最聞名的是其東峰與西峰之間的岩稜步道，名稱之由來是因為稜線下方的天王廟，而「皇帝殿」即為天王廟之別稱。一般所說的皇帝殿山，指的是自東峰起到西峰止的整條狹瘦的岩稜，稜頂之瘦狹有如刀削斧劈只容一人通過之寬，一邊是近乎垂直的懸崖，另一邊卻是與地層面平行的傾斜坡，行走時多數人都會放慢速度，有人更是匍匐前進，於是山界的人就以「螞蟻過門檻」來形容，部分較險峻的路段，設有鐵鍊繩索、鐵柱圍欄作為保護用，然而仍不失其驚險刺激，是非常受歡迎的登山路線。由於山區之地質屬幼年期，故多懸崖深壑等特殊景觀，其中永定石霸尖直指石碇，直線距離就有4公里長，是難得的岩場。東峰標高593公尺，西峰560公尺，天王峰（中峰）562公尺，天王峰剛好位於這條脊稜的中間位置，山頂插著書有「天王廟」三個字的黃旗。本區山勢雖都不高但北向視野極佳，在晴天之時朝北可以望見四分仔尾山，朝西北更可遠望七星山及磺嘴山。,0,0,1,0,0,0,0
豎崎路,位在新北市瑞芳區的豎崎路是九份地區的縱向道路，全程皆由石階所築成，漫步在豎崎路上還可遠眺山城聚落，許多具有特色的茶藝館及昇平戲院也為在這條路上，左右兩旁多是紅磚及木造建築，帶出四、五十年代的懷舊風情，夜晚時分街道上懸掛著的紅色燈籠一一亮起，更瀰漫著一股純樸靜謐的氣息，有如是一條回到過去的時光隧道。是特殊的「丰」字道路，為九份的直向道路，為一條300多個石階的階梯，有許多觀景茶坊駐點在此街道，舊道口(基山街口)也設有觀景台，可以從九份觀賞北海岸的綿延景色，在豎崎路與輕便路交會處可以看到九份著名的建築之一的昇平戲院。,1,0,1,0,0,1,0
開成殿(天公廟),位在新北市瑞芳區的開成殿(天公廟)建立於民國46年。該殿毗鄰福山宮，主祀玉皇大帝，另本殿位處九份至高點，除了可供民眾祈福祭拜，還可一賞九份的全景。九份一直是國內外遊客必遊的觀光景點，對攝影人來說，九份也是拍攝的好去處，站在九份老街的頂端，天公廟開成殿前的平台上，就能眺望居住於此的聚落，這邊特別的不只在山景，在天氣好的時候，更可以遠眺到濱海公路上的深澳漁港，在日落時分景色更令人讚嘆不止。,0,0,1,0,0,0,0
琉榔路步道,位於新北市瑞芳區的琉榔路觀光步道為淡蘭古道北路路線之一，入口在九號停車場旁，「琉榔」取自「流籠」諧音，這是一條由流籠路底之古道所翻修的觀光步道，古道的是山居的住民下山採買物品所走出來的路，早年採礦及運送物資採用流籠軌道牽引上下，解決部分路段坡度過陡，人力難以負荷的問題。這是一條由舊時流籠路所翻修的觀光步道，是先民們下山採買物品所開闢走出來的路，早年九番坑也是一處礦坑口，因產量不多而沒落，然而踏踩出來的山徑重新整建後，遊客走起來格外新鮮，登頂後兩處展望臺可以眺望基隆、瑞芳山城與海濱的景象，開闊而好看。,1,0,1,0,0,0,0
基隆山,基隆山位於新北市瑞芳區，標高達588公尺，是臺灣小百岳之一，基隆山為一座錐形死火山，屬於基隆火山群，為一座侵入式火山地形之山岳，基隆山山勢高聳獨立，再加上位置緊鄰東海，在早年是航海員於海上辨認方位的重要地標，亦是九份與金瓜石兩聚落的界山。形貌百變的水金九地標橫看成嶺側成峰，基隆山從不同的角度觀賞有不同的美景，從海上正看山形似雞籠，故舊時稱為「雞籠山」，而側看又似一位橫臥的孕婦，故又有「大肚美人山」之雅名，從瑞金公路看又似富士山，故又有「基隆富士山」之美譽。俯瞰山城的百萬夜景基隆山鄰近九份老街，亦是熱門的登山健行之處地，基隆山登山步道一路至頂全為階梯步道，並在步道中段設有兩處涼亭供登山客休憩，登上山頂，360度無死角眺望九份、金瓜石與北海岸的風景，選在黃昏時刻上山，更能欣賞九份與金瓜石由華燈初上幻化為黃金山城的百萬景致。,0,0,1,0,1,0,0
無耳茶壺山步道,無耳茶壺山步道是一條適合健行及短程來回的登山步道，又名「茶壺山」，海拔約600公尺，從金瓜石往山頂望去，山頂形狀像是一隻沒有把手的茶壺而得名，從黃金博物館或勸濟堂都能接到登山口，上坡與平路交錯，若體力不好可能會稍感吃力，眺望整個金瓜石山的美景茶壺山是一個由沉積岩矽化的角礫構成的山體，走到山頂東邊可眺望太平洋，南望半屏山，還可以欣賞到基隆山與浪漫公路，從另一側還可以看到藍黃漸層的陰陽海，在秋冬時整座山頭遍布芒花，是北部熱門的賞芒花地點之一，也是東北角最棒的至高眺望點。,0,0,1,0,0,0,0
瑞芳火車站,大正八年(西元1919)五月宜蘭線鐵路八堵至瑞芳段通車，瑞芳正式設火車站。目前火車站仍為進入黃金山城(水湳洞、金瓜石及九份)、濱海漁村(瑞濱、南雅、鼻頭角)及黑金鐵道平溪線的重要轉運站，於民國102年後，久違的深澳支線將於第三月臺復駛，將由礦業車站再度轉為觀光型車站。瑞芳火車站在臺鐵的營運總能在前三十名，主要就是靠著文化及觀光發展而再度復活的一個車站。瑞芳火車站前站正前方會經過「站前廣場」，廣場會不定時獲配合相關節慶(如端午節、中秋節)會有表演活動；另廣場旁邊有「計程車招呼站」，遊客可多加利用；前站向前走50~100公尺處有「瑞芳美食街」，地址在瑞芳區民生街35巷2號，裡面有眾多美食，如著名的龍鳳腿及林記福州胡椒餅等，遊客到了那邊別忘了去品嘗看看。另外瑞芳火車站後站可到瑞芳神社遺址及瑞芳老街，這裡可以看到一些著名的古厝，如清朝廖厝(廖建芳商行)遺址、林牙醫診所日式分駐所遺址及義方商行；往岳王路走通過瑞濱古道可到鹿仔寮山及秀崎山，喜歡登山的朋友可以到這邊走走；火車站後站還有保雲芋圓，喜歡美食的朋友可不要錯過了喔。,1,0,1,0,0,0,0
蝙蝠洞公園,位在新北市瑞芳區的蝙蝠洞公園位，鄰近濱海公路海濱隧道旁(即臺2線75K處)，內有涼亭及停車場，並設有賞蝠平臺，，於傍晚時遊客賞蝠之用，公園可經社區道路(為濂洞支線拆除之鐵道)通往海濱社區，道路原為舊鐵道，目前尚有海濱車站遺跡，供遊客探索過往之繁榮景象。也是目前台灣已知最大的蝙蝠群居洞穴，每年五、六月蝙蝠洞開始到訪這個洞穴，數量高達數十萬隻且到訪的蝙蝠為雌性蝙蝠，為繁衍下一代而聚集於此。待八、九月小蝙蝠長大後離開，隔年回來。本公園有許多蝙蝠意象設施，並設有一處看臺鄰近蝙蝠洞，以方便遊客可以到此觀察蝙蝠生態。,0,0,1,0,1,0,0
水湳洞,因電影「悲情城市」成為觀光景點的「水金九」（水湳洞、金瓜石、九份三地簡稱）吸引大量遊客前往觀光，除了人潮擁擠的九份老街外，鄰近的金瓜石和水湳洞，更展現了驚豔的文藝氣息。「山城美館」是由一群在地藝術家團隊會不定期舉辦各種木雕、金屬、繪畫等多種展覽活動，而鄰近的山城食堂更是適合放空休息的好地方，可坐擁無敵海景，一邊享用如特色饅頭與豆漿等小農食材餐點。在此眺望遠方會看到陰陽海美景(正式名稱叫「濂洞灣」)，因金瓜石山區溪水匯集入海，水中礦物質含量頗高造成氧化的作用，入海口長年形成一半金黃、一半碧藍的奇景；而在濂洞灣上方的十三層遺址，遠遠望過去很像荒廢的美麗宮殿，常被稱為「礦山上的布達拉宮」，景觀點以水湳洞停車場仰望，以及長仁社區觀景亭側看的角度最動人。,0,0,1,0,1,0,0
桐花公園,新北市土城區公所為提倡健康生態之旅，將佔地約七公頃的桐花公園，闢建完成於民國93年，他位於土城的最高峰天上山的山腰，是南天母山與火燄山構成的山谷地形，沿著石壁寮溪親水木棧道婉轉而上。這一座自然公園內，興建有露天表演及看台區、木炭窯展示區、泡茶休憩平台、俯瞰土城市區的觀景平台、供兒童戲耍的三角吊橋、立體爬網，以及螢火蟲復育區及扶輪區、獅子亭，是個多功能的休閒公園。白天可以漫步園內的賞景步道欣賞近百株桐花樹、山櫻花，在春末夏初的桐花盛開時期，在此可以感受桐花似雪的美景，也可以親近桐花生態，夜晚還有螢火蟲飛舞，讓人暫時忘卻塵囂，倘佯在大自然的懷抱。,0,0,1,1,0,0,0
孝子山登山步道,座落在平溪支線菁桐站與平溪站之間的孝子山，其實是一個步道系統的總稱，裡面矗立著好幾座獨立的山頭，包括孝子山、慈母峰、普陀山、慈恩嶺，以及中央尖等山峰。山勢雖不如其他山來得高，但其陡峻的石峰卻不容忽視。登孝子山最驚險的路程，莫過於最後一段懸空鋼梯登頂路。但若順利的登上這近幾乎垂直的岩壁，到了頂峰可鳥瞰整個基隆河縱谷，由於群峰環繞，大小山頭加總起來有20多座，因此被稱為二十四孝山，由於山形酷似大陸黃山，故孝子山也有「小黃山」之稱。,0,0,1,0,0,0,0
平溪車站,平溪車站位於平溪區嶺腳里內，是台灣鐵路平溪線上的車站。原名「台陽礦業株式會社石底線」，一開始是用來做為運煤的專用鐵路，後來因為煤礦場陸續關閉，導致當地的人口逐漸流失，平溪線差點面臨要被廢除的命運，經過地方人士積極爭取後保留下來，現今也逐漸因為放天燈的活動而逐漸讓人潮回流。平溪車站雖是簡易車站，但因歷史悠久且風景秀麗，寧靜的平溪山城最適合傾聽火車鐵道的行駛聲，漫步溪流小徑享受大自然的美好。早年稱為「石底驛」，若往菁桐站開去，會經過一座鐵橋，鐵橋橫跨三坑溪，向下俯瞰可看到平溪與石底聚落。車站一出來就是中華街，沿著緩坡向下走，與平溪街交叉處，這一帶就是老街。車站地理位置介於平溪與嶺腳間，居高臨下，下方是基隆河。門口老樹樹枝停滿覓食的鳥群，運氣好的時候，還能看見牠們俯衝獵食輕巧的飛行動作。,1,0,1,0,0,0,0
靜安吊橋,位於新北市十分區的靜安吊橋繽紛而耀眼，座落在十分里與南山里之間，鄰近十分車站與十分老街，是重要的聯絡橋梁也是十分寮地區最顯眼的地標。靜安吊橋歷史悠久，起初用途是為了要運送煤礦，後來媒礦停採之後，就改建為行人專用的交通要道，靜安吊橋從此也恪守職責至今。吊橋全長128公尺，是十分里與南山里的連絡橋樑。於民國36年（西元1947年）建造，當時是為了運送煤礦而興建此橋。位置靠近十分火車站與老街，底下是基隆河，藍白顏色的吊橋，也成了旅客到此一遊的熱門拍照景點。,1,0,1,0,0,0,0
大華壺穴,基隆河的河谷地形景觀，除了瀑布外，位於平溪站至三貂嶺之間，河床上處處可見許多圓滑的坑洞，地形學上稱為「壺穴」。壺穴的形成是因地質岩層的結構性硬度不均，經夾帶細沙的河水沖刷而產生坑洞，然後流水在坑洞中形成的小漩渦進行再沖蝕，於是形成壺型的小洞穴。壺穴通常出現在河川曲流處凹部多漩渦、急湍的河段；且河床是裸露的硬岩。其中以大華車站以下的大華壺穴群為最密集可觀之處，在水流及岩層交互作用下，幾乎所有類型的壺穴皆可在此見到，是一處大自然的地理教室。,0,0,1,0,1,0,0
丁蘭谷,丁蘭谷位在雙溪區的魚行里，是雙溪一處結合自然美景與生態工法造景的風景名勝，位於魚行里丁子蘭坑，由雙溪往貢寮方向，沿一○二線公路走，約二公里處丁子蘭坑口轉入北三九號道即可到達，昔日雙溪八景之一。青山環繞、清水清澈，是夏季戲水的景點，丁蘭谷古道是丁子蘭坑居民往來芊蓁坑的舊路，古道沿溪而行，昔日有聚落，現仍可見聚落遺跡。為一蜿蜒曲折，風景優美的溪谷，溪水清澈，野薑花盛開的季節空氣中瀰漫著淡雅花香，耳邊傳來潺潺的流水聲，令人神清氣爽。,0,0,1,0,0,0,0
虎豹潭,虎豹潭位於泰平國小附近，是北勢溪北支流源頭，潭邊兩座山丘形似猛虎與雲豹，故稱虎豹潭還有個好聽的別名「北台灣小九寨溝」。不僅山林景色秀麗，秋季還可欣賞滿山遍谷的芒花。墨綠深邃的湖水中倒映著四週的山色樹影，潭旁的山麓還規劃了一條可看到優美景色的環狀步道，秋天來此還可欣賞滿山遍谷的芒花。遊客可登上觀景平台眺望虎豹潭天然美景，目前已規劃為親水景觀區，更建有生態枕木步道，步道上方設有觀景平台，可眺望虎豹潭的天然美景。每逢假日，皆有登山人士或青年學生攜伴前往，飽覽潭光水色之美。加上封溪護漁成果逐漸顯現，魚群豐碩，已成為賞魚景點。欲賞魚者，不妨攜帶吐司麵包前往餵食，觀賞著魚兒搶食與悠然自在的生命力，絕對不虛此行。虎豹潭的最佳拍攝時機在午後至四點前，由於周遭林相茂密，大約中午過後陽光才能灑進樹林，斜照的光線更有利於呈現立體感與層次！提醒遊客前往遊憩時，請注意天氣狀況影響水位急漲情形。,0,0,1,1,0,0,0
南天花苑,南天花苑在新基里南天宮後面，距雙溪火車站僅五分鐘途程。南天宮奉祀關聖帝君，也就是三國演義裡義薄雲天的關雲長關公，香火鼎盛，四週遍植花木，長年開花。雙溪八景之一就是在新基里南天宮這裡，尤其廟後三座山丘上之杜鵑、櫻花、楓香相互爭妍，美不勝收，且有古砲、涼亭、健康步道等，仿木欄杆，曲徑通幽，香客來此，皆為幽美的景色所吸引，。南天花苑由於景色幽美，空氣新鮮，現已成為鄉民晨間健身活動之勝地，每天黎明時分，到此活動者絡繹不絕。沿著南天花苑步道而行，兩邊盛開的花朵夾道歡迎，越走越是幽靜，登高望遠，讓人心情舒暢。,0,0,1,0,0,0,0
軟橋段親水公園,位於基福公路平林段旁的軟橋段親水公園，不但景色優美、溪水清澈，加上是以生態工法建置，且封溪禁漁有成，已成為適合全家大小賞魚、戲水的好去處。也可經由稻田旁步道連接蓮花園與自行車步道，來欣賞蓮花或親子自行車騎遊。由於園區地點相當方便，每逢假日，常見遊客駐足休憩賞景，已成為雙溪區夏日避暑、戲水、賞花、自行車騎遊的熱門景點。,0,0,1,0,0,0,0
雙溪區自行車道,沒有污染、既安全又健身、且和自然環境有高度良性互動的自行車活動，不但逐漸受到民眾青睞，也是休閒觀光很重要的一環。雙溪區甫建置的自行車步道，從基福公路平林段旁蓮花園附近入口，沿蓮花園可接軟橋段親水公園步道，不但景致優美，交通亦相當方便，是一條非常適合全家大小自行車道。雙溪河沿岸有許多支流小溪，且因無汙染致水質清澈見底，配上山明水秀的自然環境與清新空氣，非常適合租自行車來場慢活騎遊。雙溪區自行車步道全長約6.2 KM，是一條結合「賞花、戲水、賞魚」的自行車步道,0,0,1,0,0,0,0
不厭亭,不厭亭位於臺102線公路上雙溪與九份交界處附近，為前雙溪區鄉長簡華祥先生所命名，取自李白詩句「相看兩不厭」，因其一面眺望雙溪區全鄉風景，另一面則可遠眺瑞芳，天氣好時甚至還可以看到遠方湛藍的海水，特定時候甚至還能看得到雲海，景觀佳好，不負「不厭亭」之名。雙溪地靈人傑，有一座貌似刀柄相連刀鋒的山，當地人稱為「菜刀崙」；若往遠方仔細看，在雙溪國小附近還有一座蝙蝠山，狀似蝙蝠展翅；另有著名八景之一「貂山春色」的三貂嶺，也在稍遠的地方佇立著；再往遠一點還可看到基隆方向山稜上有座小涼亭，那就是有名的大肚美人山，有趣的是，這裡又剛好是102線雙溪段的終點，再走幾步就是九份地界了；所有這些絕佳的景色可只有不厭亭才看得到。,0,0,1,0,0,0,0
碧潭吊橋,"碧潭吊橋位處新店溪中游，建於民國26年，橋體為雙塔雙鉸單跨式吊橋，橋長186.6公尺、寬度3.5公尺、海拔30公尺，可乘載約1,000人為新店區內知名觀光景點。由於河面水色澄碧因此被稱為碧潭。碧潭兩岸的往來，早年是以擺渡渡船為主，碧潭吊橋完工後，不僅成為聯絡中和、新店間的重要橋樑，同時由於造形優美，獨具特色，數十年後，已成為碧潭風景區的景致焦點，更成為新店區的指標。碧潭三橋1937年啟用的碧潭吊橋，是新店指標景點，短短200公尺的吊橋承載了許多人的甜蜜往事。實際上碧潭不只一座橋，因吊橋鐵索難抵歲月侵蝕，1956年，下游修築水泥結構的碧潭橋，1997年北二高通車，又多了一座大拱橋，使碧潭同時擁有老中青三座橋梁，橫跨不同年代，成為特色景觀。這座「全台第一座會隨音樂律動的光雕吊橋」，橋上一共使用17,472顆LED燈，，絢麗燈光倒映在河畔中，更增添了碧潭無限的月色風情。碧潭之夜，越夜越美麗！夜間的碧潭吊橋妝點著彩色燈光，就像是橫跨水面的彩虹，也成為情侶們造訪碧潭，牽手共賞美好湖光山色的首選約會景點。",0,0,1,0,0,0,0
觀音臺,座落坪林國中後方山頂上，這裡本來是日據時期神社的所在地，後來才改建為觀音臺。有步道可前往，觀音臺高40呎，在直徑21公尺的圓形造景廣場，觀音聖像即座落於廣場正中間，含蓮花座高約11公尺，身朝南方層層山巒，象徵長佑子民源遠流長。不但是坪林當地的地標，也是北臺灣地區最高的青銅製觀音像，順著觀音臺步道上下山，觀音臺面向「思源臺」，與茶郊媽祖遙望相對，庇護茶鄉黎民。遊客既然都已經來到這裡，不妨多走點路鍛鍊一下身體，而且從這裡還可以看到北宜公路和雪山隧道，視野超讚！,0,0,1,1,0,0,0
坪林親水吊橋,位於新北市坪林區的親水吊橋就位於坪林形象商圈末段，從加油站旁牌樓下階梯，即可進入親水吊橋。「雙龍合抱，共佑坪林」是規劃坪林親水吊橋的原始構想，吊橋橫跨北勢溪，長度約60公尺，面寬2公尺，可聯繫北勢溪二岸觀魚步道，將坪林茶業博物館、坪林吊橋、形象商圈等景點串聯一起。這裡也是欣賞水底魚群戲水的最佳高處位置，從上而下觀察，這才發現吊橋下方則是魚群閃閃發亮，密度之高令人嘖嘖稱奇，現在已是遊客必訪之地。讓人驚嘆坪林的封溪護育果然成績斐然，很多遊客都會帶著魚飼料、吐司在橋上拋丟食物給魚兒吃，雖然公所沒有禁止，但還是要提醒遊客不要把垃圾丟到河水裡，不但污染水源，要是讓魚吃進肚子裡那就太缺德了喔！,0,0,1,0,1,0,0
虎寮潭吊橋,經由坪林市區行駛坪雙路，約至五公里處右轉行駛虎寮潭支線，約一公里即可到達虎寮潭吊橋，即可自在地欣賞吊橋之美及聆聽北勢溪潺潺之音。群山環繞，形成宛若狗齒般的形狀，奇形怪狀的溪石與靜謐的溪水形成強烈對比。環顧四周都是碧綠溪水，低頭一望就能看見溪中自在悠游的魚群，隨意按下快門都是漂亮的照片。虎寮潭吊橋是坪林地區著名的吊橋，位於虎寮潭橋上游，總長為110公尺，為早期先民跋山涉水常用之橋。,0,0,1,0,0,0,0
虎寮潭,到坪林一遊，除了買茶葉、吃茶餐，不妨走近山裡、步上吊橋，欣賞虎寮潭的狗齒地形。狗齒地形是因為地層擠壓傾斜而翹起，在北勢溪的沖刷下，脆弱的頁岩崩解而留下鋸齒狀的砂岩，彷彿狗兒的牙齒般而得名。隨著翡翠水庫在北勢溪上游興建，許多狗齒地形沒入水中，但走近虎寮潭，站在虎寮潭吊橋上，仍可一覽狗齒地形的壯麗。,0,0,1,0,0,0,0
