name,description,0,1,2,3,4,5,6
百吉林蔭步道,早在百吉隧道修築之前，大溪通往角板山、巴陵等復興山區大多是經由百吉步道(舊名石龜坑古道)，從清代到日據時期一直以來都是交通重要幹道。民國33年隨著百吉隧道輕便鐵路通車，百吉林蔭步道不再扮演交通樞紐的角色。民國38年起，慈湖列管為軍事管制區，從此讓這百吉步道蒙上了一層神秘面紗，這一隱身長達半世紀之久，也因此讓區域自然生態免於開發而被破壞。來百吉步道不只是歷史人文的洗禮，也可體驗豐富無比的自然風貌。春至秋季可尋訪黑翅螢、山窗螢，跟著點點螢火在夜暮時分享受山林靜謐；冬季來訪有機會與黃嘴角鴞、竹雞、台灣藍鵲、灰喉山椒鳥等常見鳥種相見歡，驚喜無限；沿路藏著多樣的植物，最具知名的油桐花，每年花季五月雪灑落蜿蜒林徑，增添浪漫情懷。此外，還可見到杜鵑、山棕、腎蕨、筆筒樹、大葉桉等樹種，黑鳳蝶、蛇目蝶、竹紅弄蝶、端紫斑蝶穿梭其中。全程2.8公里的百吉林蔭步道全程皆是寬闊柏油路面，僅供遊客行走，沒有一般古道陡峭坡度，可說是一條無年齡限制的入門步道，適合親子共遊。沿路享受原始山林浴，芬多精與負離子喚醒身心，感受極致放鬆。遠眺山下大溪全景，品味無邊界視野，絕對不虛此行。百吉林蔭步道另可近接大艽芎古道、溪州公園等特色景點。,0,0,1,1,0,0,0
齋明寺古道,■ 即日起齋明寺園區僅開放部分區域供參觀。另，導覽申請請務必事先上網預約，不接受團體臨時參訪。詳如連結。現為桃園12座市定古蹟之一的齋明寺，側旁的古道約建於1923年，是信徒前往寺廟朝拜的必經要道，目前為河西地區三大古道其一(另二條為御成路古道、蟠龍崎古道)。石板路的石材取材於大漢溪，為齋明寺創始人李阿甲先生第四代孫江連枝先生（法號普海）聘工人鑿砌、鋪疊而成。踏上密集的石階，遙想當時信徒需渡船而來，並跪拜前行齋明寺的朝聖景象，頗使人有沉浸文化洗禮之感。齋明寺古道接桃64線處，一牌坊靜默豎立，其上題字「日夜溪聲尋道岸，縈缁轍跡擁賢關」，百年歲月彷彿在此停駐。悠悠林道，古木參天，潺潺溪水，沁涼入心，從高處俯瞰，昔日大溪八景之一-「崁津歸帆」雖已不復見，仍能一擁懷古之情。走訪這條百年古道，用不一樣的視角回眸大溪風華，頗有尋幽訪古之趣。,0,1,1,0,0,0,1
御成路古道,御成路古道為大溪河西地區三大古道之一(另二條為齋明寺古道、蟠龍崎古道)，由「御成｣一詞不難見出曾有皇族來訪的端倪；這條於1788年搭建的古道，原是當地居民通往新竹、龍潭互市之徑，1923年因東宮太子訪台，當地仕紳募資將其修築為今日所見的石板道路，位於國防大學中正嶺後門的古道入口處，設立一座御成路紀念碑，其上即為捐款名錄。   御成路古道又名「九號崎古道｣，源於桃園大圳的第九個涵洞於此，桃園大圳為嘉南大圳之父-八田與一在台首次參與規劃的工程，興建當時因工程困難度高，殉職者多達55名，古道上的「供養塔｣記載著殉職名單與開鑿歷程。塔邊可看到桃園大圳導水隧道，往下望去見流水湍急，令人更為由衷讚佩曾參與這北台最大水利工程的職工們。塔前立有桃園大圳圖文看板，簡介建圳緣起、建圳經過、工程概況。 除了歷史遺跡，御成路古道亦是桃園著名的油桐花步道，每年四、五月，五月雪灑落在石板路上，增添幾許浪漫情懷，古道坡度較緩，途中設有涼亭，供民眾暫作休憩，可一邊健行一邊欣賞蔚藍天空、蓊鬱林木、柔美桐花相融的自然美景。,0,1,1,0,0,0,0
龜山第一河濱公園,為桃園市的第一條水岸自行車步道，自民國98年8月啟用，這條水岸自行車步道是桃園市的「清溪川」，也是朱前縣長立倫推動市內溪流整治的建設之一。自行車步道工程沿著南崁溪河岸，從龜山區南崁一號橋一路蜿蜒到蘆竹市南崁溪橋，全長15公里，沿著河岸迤邐的自行車步道和人行步道外，在龜山區陸光新城旁的河川公地設有花木扶疏的大型公園綠帶，水務處貼心的施作溜冰、籃球、網球、槌球等場地及兒童遊樂區、老人休閒運動區。第二、三處的大型公園綠帶，分別設在桃園巿虎頭山下和蘆竹區忠孝西橋下南崁溪邊。全線水岸自行車步道啟用後，水務局以此為主幹，要打造多條支幹，串聯兩岸週邊廿多所學校、虎頭山公園、桃園體育園區、桃園巿多功能藝文園區、台茂購物中心等，讓水岸自行車步道自成一個路網，沿著南崁溪水岸可安全、快速、便捷抵達沿岸各處。,0,0,1,0,1,0,0
溪口台地,溪口台地是大漢溪在流經復興區角板山南面時，河道大轉彎所形成的一塊三角形台地，共有四層台階，上兩層為梯田、下兩層為草坪，第三層還有小公園，是地理教學的最佳戶外場景。由角板山可於思親亭眺望，或者由角板山公園下方石階往下，過溪口吊橋亦可抵達台地。溪口吊橋是一座相當細長且優美的吊橋，已經有四十餘年的歷史，吊橋中央可觀賞美麗的大漢溪河谷風貌與水庫豐沛蓄水量。,0,0,1,0,0,0,0
青塘園,「青塘園」在台灣高鐵桃園站附近，原本是一座農業灌溉用的埤塘，有調節防洪的功能，經過規劃之後，成為都市民眾的親水空間；這裡設置親水緩坡、觀景平台、木棧道、人行步道及戶外劇場等多元的遊憩空間，是都市裡一個寧靜、休閒的好去處，還曾經榮獲台灣公共建築相關大獎！來到「青塘園」，可見碧綠的池塘中有許多水生植物和豐富的生態，大片的荷花池吸引民眾停留欣賞，不論是白天或傍晚，這裡成了親子、情侶散步的好去處，也是攝影愛好者的熱門據點！2015年雪白色的「青塘園景觀橋」建造完成，在夜晚投射燈光中營造出浪漫的氣氛，更可透過橋上的「永恆之塔」對著北極星射出光束，表達「永恆」概念，是青塘園不分晝夜的新亮點。,0,0,1,0,0,0,0
桃園1-4號生態埤塘,"1-4號生態埤塘設置有350公尺的環池步道、生態水池、原木平台、景觀涼亭、木棧道等等親水設施,除了讓埤塘保有原本功能，也增加遊客親近大自然的空間。1-4號生態埤塘分為兩部份，較大的為魚池，裡面有土鯽、吳郭魚、台灣梅氏鯿、青魚、鯉魚、明潭吻蝦虎⋯等許多意想不到的魚類，如果想認識牠們，涼亭的柱子上也有魚拓的標示可以參考。魚池的另一邊則是被落羽松、海桐(也叫七里香)、楊柳環抱的生態池，漫步在彎彎曲曲的環池步道上，可悠閒欣賞池邊靜謐之美，佇立在木棧平台上還能見到低空掠過的白鷺鷥身影，令人驚喜連連。夏天時香水蓮也將池水點綴得繽紛亮麗，絲毫不讓水鳥專美於前。另外，在水塘邊還有一處階梯式廣場，平時除了可以坐在階梯上賞景，也可以做為小型表演場地。",0,0,1,0,1,0,0
老街溪水岸自行車道,老街溪水岸自行車道，全程3600公尺，串聯平鎮區新勢公園、南區青年活動中心、老街溪河川教育中心、翠堤廣場、翠堤橋等景點。沿著自行車道，除了可欣賞蛻變中的河畔景觀，還有10餘處的文化、生態、觀光及休憩點也將陸續開放。愈來愈美麗的老街，讓人不自覺地愛上它。 老街溪的整治包含防洪水利、橋樑改建及水岸景觀再造，除了符合防洪標準，也強化橋樑景觀意象，兼具防洪及造景功能。河川整治後的老街溪，透過自行車步道，讓整座城市有了呼吸的空間。在生態工法的協助之下，老街溪不再灰暗骯髒，取而代之的是陽光明媚的水岸風光。 在這煥然一新的河岸邊，有居民生活的痕跡，有綠意盎然的植被，也有寬廣的新勢公園。到了河川教育中心，也有讓遊客停下來休憩的地方。動中取靜的教育中心，肩負讓人們了解與自然共生的責任。騎在路上，人與自然的和諧空間就隨著單車道一路延展開來。,0,0,1,0,0,0,0
霄裡大池(霄裡池),具200多年歷史的霄裡大池，不只是桃園第一座埤塘，也是八德地區面積最大的埤塘。乾隆年間平埔族人以其社名「霄裡社｣命名此地，並聯同漢人於八德最南端，依地形開鑿霄裡大池，匯聚溪水及湧泉成為霄裡大圳(石門大圳前身)的水源地，充沛的灌溉資源，造就 「看不盡的霄裡田，吃不完的霄裡米」的豐饒景況。沿著環湖步道而行，欣賞綠油油的稻浪迎風搖曳的同時，遙想先民奮力拓墾的艱辛，令人不由得生起感恩之情。   在車潮川流不息的桃112線上，霄裡大池的宜人風景展現了一種對比魅力。放眼望去，6甲大的湖面閃耀著晶瑩波光、堤岸旁成排松林隨著四季五彩變化、三合院古厝與矮房交錯著、遠山層層疊疊勾勒出潑墨想像、旅人們三三兩兩倚著觀景台談笑，偶有單車騎士在涼亭下歇息&hellip;，冬季造訪還可至浮筧街185巷，加碼欣賞落羽松與波斯菊的夢幻絕景。 霄裡大池除了是在居民的閒暇去處，也是「八德茄苳霄裡陽光鐵馬道｣的南端起始點，沿線向北，可順遊客家老屋聚落、石母娘娘文化景觀區、大伙房浣衣池等人文地景，走一趟知性小清新之旅。,0,0,1,1,0,0,0
大平橋,■即日起因應整修工程暫停通行，詳情可電洽本府文化局(03-3322592#8804)。順著三坑鐵馬道可以直接騎到曾被票選為全國歷史百大建築的大平紅橋，座落在龍潭區三坑里，因全橋以紅磚構造，故名紅橋。這座橋樑建於西元1923年，由大平、三坑里民發起興建，在庄役場（區公所）的補助配合鄉民捐款，以及日本人捐贈之下，由大倉組營造場負責興建，採用與桃園大圳工事相同的清水磚為材料建造而成。橋身長約十餘公尺，跨越打鐵坑溪，曾是大平里民對外的主要聯絡道，共設有五座橋拱，造型優雅，迄今依然完整如初。目前大平紅橋附近已規劃為親水公園，是休閒的好去處。,0,0,1,0,0,0,0
南崁溪水岸自行車道,多數城鎮都設有自行車道，但是能夠近距離欣賞水岸風光的倒是屈指可數，南崁溪水岸自行車道是少數成功融合自然地景的休閒車道，全長15公里，以公園綠地與造景橋串聯龜山、桃園、蘆竹、大園，單車行進間享受市區難得的開闊視野，白天夜晚各有不同風情。騎乘在自行車道上，原生魚種悠遊溪中，乾淨的水質吸引許多白鷺鷥在此覓食，加上就地取材的卵石砌成的河堤，宛如一幅生態風情畫。車道從龜山區南崁一號橋經虎頭山公園、至蘆竹區南崁溪橋，一路綿延的綠廊，種有九芎、流蘇、桃花、山櫻花等樹種，田野風情之外更增添綠活氛圍。         車道全程路況屬平坦，沒有大起伏的上下坡，適合一家人來趟單車輕旅行，車道設置路燈照明設施，沿途多個親水公園，設置生態池、自行車停放處、健走步道、球場、草坪、簡易兒童遊樂設施，提供多重休閒功能，龜山與蘆竹堤岸另有舊型打水幫浦。入夜後的南崁溪，亮點全在絢麗的景觀橋上；龜山第一河濱公園星月橋、桃園汴洲之美橋、桃園青溪彩虹橋、蘆竹南崁溪河濱公園竹夢橋等，隨著時間改變的光雕設計，將炫目彩光投射在橋身，富現代感的橋樑有別於白日的美感，讓人驚呼的美景，使許多單車客佇足欣賞。,0,0,1,0,0,0,0
國立體育大學,國立體育大學腹地廣大，生態資源豐富。湖泊座落校區內，雁鴨悠游湖面之上，陣陣魚群穿梭往來，可進行餵食相當有趣。沿著湖畔步道行走，可享受怡然自然一派悠閒。此外還有寬廣的草原，最適合親子同遊共享天倫之樂。,0,0,1,0,0,0,0
茄苳里埤塘公園,茄苳里埤塘生態公園擁有完整的生態、清幽的環境，廣闊的湖畔設有景觀步道，常吸引民眾漫步其間，也適合騎乘自行車一覽園區風光。,0,0,1,0,0,0,0
新溪口吊橋,第三代新溪口吊橋是一座相當細長且優美的吊橋，全長303米，吊橋中央可觀賞美麗的大漢溪河谷風貌與水庫豐沛蓄水量，是全台最長的懸索橋，帶您見識大漢溪與群山環抱的壯觀風景。大眾運輸：如要前往新溪口吊橋，可搭乘桃園客運大溪站搭乘公車5104、5105、5106、5109等班次皆可抵達復興站●參觀重點：大漢溪谷美景、體驗吊橋搖晃的刺激,0,0,1,0,0,0,0
八德落羽松森林,落羽松紅了，旅人的臉就笑了！每逢冬季寒意至，沿著霄裡大池旁的浮筧街185巷，近3公頃的八德落羽松森林染上瑰麗的漸層色彩，橙黃、艷紅、藍天白雲與潺潺溪水，總吸引成千上萬的旅人們爭睹這片如印象派畫作的詩意風景。 落羽松屬於杉科植物，因原產於美國所以又稱美國水松，其樹高可長至50公尺，常作為造景植物與建材。與一般的針葉樹不同，落羽松的針葉會隨著季節入冬而由綠轉紅，最後如羽毛般飄落。桃園境內兩大落羽松打卡熱點﹣大溪落羽松大道﹙原名為石園路﹚以及八德霄裡，在IG、FB洗版爆紅後，觀賞人潮從未減少過。大溪落羽松大道約種有3百棵落羽松，雙排並列打造出一種清幽美感。而位於茄苳溪畔的八德落羽松森林，屬於私人苗圃，近3千棵落羽松拔地而起，有別於大溪｢小而美｣的宜人風光，獨特的壯觀景象，增添旅行的驚艷。 沿著霄裡大池旁的步道前行，落羽松的絕美風景盡收眼底，而一旁的田園同樣令人沉醉；休耕的農田中，玲瓏可愛的黃波斯菊迎風搖曳，常見於山區的紅藜驚喜現身，開闊的霄裡大池，池面如鏡，倒影著遠山近林，不時有騎單車的旅人以及雀鳥翱翔身影經過。愜意欣賞美景之餘，也可以仔細觀察柱狀呼吸根、淡褐色毬果等落羽松特徵，給自已上一堂有趣的自然課。,0,0,1,1,0,0,0
鑊篤陂塘生態公園,客家先民所建造的陂塘、水圳是很珍貴的水文化，平鎮區公所配合市府推動「一區一陂塘生態公園」計畫，將鑊篤陂塘結合當地的客家文化，轉型為陂塘生態公園，並獲得109年桃園市政府第四屆公共工程金品獎第四級佳作，成功將陂塘轉型為防災及景觀公園，兼具提升環境市容與傳承先民留下之客家文化兩種優點，更使平鎮成為風景優美、深具在地歷史特色的好地方。（資料來源：平鎮區公所）,0,0,1,0,1,0,0
巧虎夢想樂園,全台首家「巧虎夢想樂園」未開幕即造成話題，除了樂園內設計的多樣遊樂設施外，能與巧虎近距離的互動更是一大亮點！坐落於桃園高鐵站旁「置地廣場桃園」的「巧虎夢想樂園」，即日起接受線上預約，每天共4個場次、每次2.5小時，歡迎大家上網預約，讓親子一起來場難忘的冒險之旅。（資料來源：巧虎夢想樂園）,0,0,1,0,0,0,0
竹東河濱公園,騎上單車，徐徐涼風吹褪了身上的熱氣...。沿著清澈的頭前溪畔，眼看一片綠草如茵，青草隨著微風的吹送，搖曳生姿，這是城市中難以見到的遼闊。「竹東河濱公園」保留了相當完整的自然生態，設有許多運動場與運動設施，整合遊憩、生態、自然淨化功能，建構一處兼具水質淨化、環境保育、觀光休閒的帶狀綠色廊道。沿著河岸，錯身而過的，不再是匆匆趕路的人群，而是停下腳步，躺著、坐著、漫步著的幸福姿態。,0,0,1,0,0,0,0
關西東安橋,橫跨牛欄河上的東安橋為五孔石砌拱橋，造型兼具結構與美學，古名為「彩鳳橋」，興建於1933年（昭和8），為聯絡關西街區與東安里之要道。東安橋原本只是一座木造便橋，每當山洪爆發時便被沖毀，交通也隨之中斷。地方人士因而倡議建橋，由當地仕紳聘請日本技師設計，再雇工至錦山地區採集紋理細緻的石塊，以人力搬運至現場，交由當地知名的石匠李鎮帶隊砌築歷經數十年使用仍完好，顯見其工程技術與品質之高超。,0,0,1,0,0,0,0
軟橋社區,沿著南清公路往五峰的方向走，隨著美景綿延橫亙，進入了「軟橋社區」。川流不息的上坪溪水淙淙流過，是大新竹地區百姓的命脈。竹東圳的圳路上設置了桂山發電廠軟橋分廠，是全台最小的無人水力發電廠，台電公司將其規劃成水力發電紀念公園，極富教育意義。「社區彩繪」更是社區的一大特色。走在社區街道上，可以從家家戶戶的牆面，看到許許多多的故事，每幅畫作點亮了軟橋社區，也點亮了居民的心。騎乘單車悠遊軟橋自行車道，恣意倘徉綠意美景，忘卻俗世塵囂。,0,0,1,0,0,0,0
蓮花寺步道,「蓮花寺環山步道」為第一環狀步道位於新豐鄉與竹北市濱海公路交界處步道系統採枕木構造為主，途經粘質壤土，植生被覆茂盛區、荔枝園區，兩側遍植桂花巷，溝新宜人。輔以棧橋休憩觀景設施，登頂更能遠眺台灣海峽。由於鳳鼻山西端突出台灣海峽，山的末端好像鳳鼻，俗稱「鳳鼻尾」，海濱風景極佳。每當夕陽西下，紅霞和山色掩映，加以綠樹圍繞，「淡水廳誌」把它列為全淡八景之一，名為「鳳崎晚霞」。&nbsp;&nbsp;,0,0,1,0,0,0,0
金獅(寺)步道,「金獅寺步道」因緊臨名剎「金獅寺」而聞名，位於湖口村6鄰。昔日是新埔到湖口農產品運輸之重要古道，原為羊腸小徑，經水保局第一工程所於86年6月規劃成為一排排大圓石砌成的步道。步道之景觀台更是欣賞風景最佳地點，每當晴空萬裏，向北可透過廣的桃園臺地而遠眺台灣海峽，金獅寺前更有滿坑滿穀的油桐樹，每逢春夏之交，滿樹繁花、如雪披被，非常壯觀。,0,0,1,0,0,0,0
鳳崎落日步道,步道入口位於天德堂西側，終點位於蓮花寺停車場；沿線楓香、烏桕、九芎、樟樹、山櫻花、相思樹、杜英、黑松等多樣性的植物景觀，景致豐富，美不勝收；沿路綠蔭遮蔽，清幽涼爽，適合清晨及黃昏時登山健行。登高可眺望新竹沿海景觀，西落夕陽，令人心曠神怡。,0,0,1,0,0,0,0
犁頭山步道,犁頭山位於新竹縣新埔鎮與竹北市、芎林鄉交界處，以地形類似古人犁田之犁頭而得名，東起新埔內立里，西迄竹北高速公路東側，呈東西走向，為新竹縣兩大河犂、頭前溪、鳳山溪分水嶺，山以南屬頭前溪流域，以北屬鳳山溪流域，海拔高度156公尺，南側坡面陡峻，北側較為平緩。 惟犁頭山早期均為農民茶園，今日雖已荒廢，林間仍可見不少老茶樹，步道主線及各入口路線，其實多是附近居民早期上山採茶或耕作所行之蜿蜒小徑。民國七十年代農業衰退，山上茶園逐漸荒廢，採茶道路多數野湮沒在荒煙蔓草中，連早期商旅熙來攘往，翻越犁頭山的月桃窩古道也無人通行，犁頭山成為荒山野嶺，除西段三角點附近一公里多路段，尚有民眾踏青健行之外，餘均緲無人煙。,0,0,1,1,0,0,0
巨埔步道,巨埔步道位在巨埔農場的後山，從巨埔蔬果產銷班的廣場出發，沿著林間道路上坡，映入眼簾的是，蜿蜒而上的枕木步道。兩旁的樹木綠蔭夾道，步道沿途皆有油桐樹、相思樹、松樹、筆筒樹、魚藤等，沿路清幽涼爽，鳥類有布榖鳥、大冠鷲等蹤影。全程約三公里多，遊客可沿著步道倘佯在綠蔭中，欣賞花卉，油桐花季時遊客絡繹不絕，或參觀育苗中心。總面積約十公頃的環山步道中，有不少植物和蔬果，值得細細品味。其中情人谷步道：因部份步道寬度較小僅可供一人行走，且坡度較陡行走不易，不適合兒童行走。,0,0,1,1,0,0,0
清水古道,清水古道是新埔鎮早期運送茶葉、柑橘下山的必經之路，已有近百年歷史，古道幽靜、蟲鳴鳥叫，風景優美，極具觀光價值。,0,0,1,0,0,0,0
燒炭窩古道,燒炭窩古道古樸的殘階及幽幽竹林，但古道大部份屬於陸軍裝甲兵訓練場範圍，古道需穿越陸軍裝甲兵訓練場已被剪破的鐵絲網才能進入古道最完整的路段。一塊塊平整的石塊舖成的山路，是昔日為方便挑夫行走，由此爬往湖口臺地。古道左側為卵石堆砌的駁坎，右側為繁茂的竹林。且可與土牛溝古道相接。,0,0,1,0,0,0,0
照門步道群–霽月步道,位於陳家農場旁霽月步道的入口，枕木步道兩側的花草與綠蔭所構成的綠色隧道。步道的高點，可沿著石板階梯上下，穿梭在綠蔭中。途中到處可見相思樹林、魯花樹、九重葛、桂花等植物。桐花季走在這條步道裡，可以看到照門山頭的桐花，當然眼簾近處也可以看到桐花，或許數量不多，但佇足欣賞「五月雪」，另有一種美感。,0,0,1,1,0,0,0
照門步道群–觀南步道,步行在步道上，感受著大自然的氣息，放眼盡是湛藍的天空，翠綠的山景，古樸精緻的南園清心園林休閒農場，以及散佈在山谷中的鄉村聚落，一幅幅動人的景緻映入眼簾。步道兩旁林立著油桐樹，於油桐花季時別有一番風味，觀南步道的末端從鴛鴦池出口。,0,0,1,1,0,0,0
照門步道群–九福步道,由「明池」循著石梯而上，這是九芎湖內坡度較陡的步道。林木蓊鬱，令人心曠神怡，更可呼吸大自然釋放的芬多精，植物種類繁多，是絕佳的森林浴場。獨角仙、台灣鳳蝶、五色鳥等昆蟲與鳥類，到處可見蹤跡，是條豐富的休閒生態步道。可以眺望九芎湖及箭竹窩的農村景緻，天氣晴朗時，可以遠跳臺灣海峽。&nbsp;,0,0,1,1,0,0,0
三段崎古道,「三段崎古道」位於新竹縣新埔、芎林兩鄉鎮的交界處，是昔日芎林鄉下山村農民，運送柑橘等農作物前往新埔販賣所走出來的一條道路，大約形成於清朝道光年間。隨著公路及產業道路的開通，古道運輸的功能早已式微，如今只成為單純的山間農路而已。然而沿途仍可觀賞滿山坡的柑橘園，還有古樸的鵝卵石階路，以及老樟樹陪伴著古老的石棚土地公，默默地敘述古道逝去的歲月往事。「崎」，客家話的意思是指「山坡、斜坡」；「三段崎」，是指這條古道沿途有三段山坡石階路（石崎仔）。由新埔的三段崎前往芎林鄉，須翻越石頭坑山，先後經過三段石仔崎路，因此而得名。&nbsp;,0,0,1,0,0,0,0
石光(老虎山)步道,昔日是石岡子與龍潭之間的一條重要農產古道，已有近兩百年的歷史，直到幾十年前公路興建後，古道才逐漸沒落。近年在當地社區發展協會努力下，獲政府專款輔助，由石光社區發展協會及政府重新整修石光古道，古道的起點為石光國中，終點為茶園涼亭，並於沿途設置涼亭、觀景台及木椅，以供遊客遊憩。本次調查將石光步道及石光古道合起來，石光步道為聖母院至茶園涼亭。因為此步道行經老虎山故當地人稱此條步道為老虎山步道。,0,0,1,0,0,0,0
四寮溪步道,位於關西鎮的四寮溪步道全長460公尺，步道沿著四寮溪興建，自然天成的濕地環境與溪流，造就了豐富的生態景觀，沿途的林蔭與溪水，保證清涼又消暑。,0,0,1,1,0,0,0
石牛山步道,步道沿線很多陡峭路段，時而峭壁時而陡坡，手腳並用才能往前走；一邊走一邊欣賞果園、菇寮及鄉村景緻，多樣的植物及鳥類、昆蟲生態；豐富多變的步道風光，直到攻頂時一切豁然開朗，360度的開闊視野，可眺望石門水庫、大溪、龍潭、三峽等地區，亦可看見鳥嘴山及蜿蜒山道，一切的疲累早已消失。,0,0,1,0,0,0,0
飛鳳山步道,飛鳳山海拔435.5公尺，是九芎山的最高峰，因山形似飛鳳伸頸行將歛翼下降之勢而得名，山上遍植白梅、杜鵑和鳳凰花，山貌隨著時序轉換而有不同變化。山區內有雲谷寺、代勸堂、感應橋、新鳳池、蓮池等名勝，沿著綠蔭遮天的步道一一走訪，清風徐徐來，暑氣全消。飛鳳山上遍植的鳳凰木，夏日開花時節，處處殷紅，冬季梅花盛開，處處雪白，飛鳳探梅，自古以來即列竹縣八勝之一。後山有縣府闢建的步道可登山、踏青、遠眺觀景。,0,0,1,1,0,0,0
文林生態古道,古道原是早期山區居民進出的道路，而隨時代變遷，居民紛紛外遷，農作廢耕，古道便逐漸荒廢。後來，在文林社區發展協會努力下，爭取文建會經費補助，並號召社區志工協助，終使古道重見天日，而蛻變為一條休閒的踏青路線。古道全長約3公里，大約一個小時左右就可以走完。,0,0,1,0,0,0,0
