name,description,0,1,2,3,4,5,6
朴子溪生態,朴子溪源起阿里山山脈天王山芋菜坑，全長76公里蜿蜒嘉南平原，在船仔頭附近進入東石鄉，此段感潮帶沙洲、濕地遍佈，東石大橋到東石南橋段招潮蟹、彈塗魚、國寶級紅樹林、上千隻白鷺鷥群聚，豐富生態令人驚艷。,0,0,1,0,1,0,0
竹崎親水公園-天空走廊,「竹崎親水公園天空走廊」位於嘉義竹崎親水公園內，建造此廊道期間，沒有砍掉任何一棵樹，完全落實環保與綠化。天空走廊建於樹林之中，全長大約185公尺，最高的地方有19公尺高，將近五層樓的高度。走廊的步道是由網子構成的，站在上面，可以透過網子觀看下方的風景。,0,0,1,0,0,0,0
竹崎親水公園-花仙子步道,「竹崎親水公園花仙子步道」位於嘉義竹崎親水公園內，建造此廊道期間，沒有砍掉任何一棵樹，完全落實環保與綠化。花仙子步道在樹林間交錯，坡道平順和緩，所以可較不費力的行走；全長大約400公尺，適合小朋友、老人家或行動不便的朋友前來，也成為遊覽車觀光的必停靠景點。沿途可賞野薑花、杜鵑花，更可遠眺梅山鄉太平，適合生態教學和散步踏青。白色系的花仙子步道，像在雲河裡穿梭森林間，漫步其中不只能吸收芬多精，還有淡淡的野薑花香。,0,0,1,1,0,0,0
天木,「天木」將高鐵嘉義站及嘉己人公園附近區域，假想為嘉義縣的大地縮影範圍。藝術家以北緯23.5°的北回歸線經過嘉義縣的神木、平原為原點，運用相關的自然元素、造型結構等，活化出與大自然相同步調的共感空間。夜晚「天木」閃耀如天際線上的彩色寶石，標現出北回歸線城市的地域位置。「天木」象徵阿里山的通天神木，佇立永生。高臺二座，兩手牽連，心心相印；神木懷中，二顆紅金色種子，生命永續相傳。依偎高鐵站旁，迷濛的春霧、淋灕的夏雨、璀璨的秋霞、烘暖的冬日，恭迎佳客，共享嘉義四季的樂景。,0,0,1,1,0,0,0
竹崎車站,竹崎車站是阿里山鐵路平地線和山地線的分界，早期火車必須在此添煤加水。且山地線是以28公噸蒸汽火車行駛，平地線則是18噸蒸汽火車，因而在此將火車調頭，以「後推方式」推動列車上山，形成溝內之「三角線軌道」，火車以三角前進後拉方式掉頭，十分新奇。竹崎車站約建於1906年。是阿里山森林鐵路由平原地形爬昇往高山地形的起點， 昔日在此站必須更換另一火車頭，才能順利爬昇。阿里山森林鐵路沿線，鹿滿車站、竹崎車站都仍保留日治時代的檜木建築，具有濃濃的日本建築風味，其中竹崎車站保存最為完整，是整條阿里山森林鐵路中最難得的建築。阿里山是世界著名的高山鐵路，早年阿里山公路未開通前，阿里山鐵路一票難求，很多人為了搶座位，都從窗戶爬進去佔位子，如此盛況實在令人難以想像。公路開通後鐵路經營成本較高，加上屢遭天災重創，營運日益艱難。竹崎車站距嘉義起點14.2公里，海拔127公尺，在1946年1月竹崎車站因為老舊而重新翻修，成為今日所見的模樣，目前是阿里山鐵路沿線中仍繼續使用，且保存完整的木造結構建築。平日除了搭車民眾之外，吸引不少情侶佇足及準新人前來拍婚紗留念。,1,0,1,0,0,0,0
內葉翅吊橋,【吊橋兩端平台及棧橋木作設施會因天災損壞封閉，遊客前往請先向維管單位：大埔鄉公所查詢當地情況05：252－1310】內葉翅吊橋所在地俗稱「射免潭」，「射免」是高山鯝魚的台語俗名，而內葉翅吊橋的「內葉」為「老鷹」的台語俗名。亦即此地溪流有攸游的鯝魚，而天空山谷有盤旋飛翔的老鷹，生態景觀非常豐富。 內葉翅吊橋橫跨曾文溪，兩端主塔高分別為20公尺及12公尺，跨度164公尺。吊橋銜接兩側步道平台，橋樑設計新穎，橋塔巍峨壯觀，白色的吊橋主索及拋物線形的抗風索色彩典雅，與環境相容，站在吊橋上往東側（上游）可欣賞曾文溪攔砂壩形成的大瀑布，攔砂壩寬20多公尺，深度近10公尺，為國內罕見的人造大瀑布，雨季時大水衝下，氣勢磅礡，媲美十分瀑布；吊橋西側（下游）為河谷沖刷形成的峽谷，有「三峽峭壁」之稱，景色壯麗。吊橋與俗稱「無腳橋」大埔拱橋遙相呼應，是一處能讓遊客盡情徜徉於山靈水秀的世外桃源。,0,0,1,0,0,0,0
瑞太古道,瑞太古道位於嘉義縣梅山鄉瑞里村通往太和村；昔日稱為「幼哈林道」，是聯絡瑞里、太和間的著名管道，全長五點二公里，單程徒走約須三小時。 瑞太古道起點位於鹿仔菜林的鼎豐茶場旁邊；途中在抹油坑與回頭嶺之間分為兩支段，並形成一個環形步道。抹油坑、英雄坡、魔窟石洞到回頭嶺這一段，是始建於1870 年代的古道，步道較陡有三百多階的石階上坡，目前整段林相多為竹林，生態較為單調。抹油坑、望天崖到回頭嶺這段，是1931年改建的古道，步道較平緩，林蔭蔽天，走來輕鬆宜人，而且林相變化多，生態也較豐富，白耳畫眉、冠羽畫眉、大彎嘴、小彎嘴、山紅頭、藪鳥都可見到，算是瑞太古道生態觀察的精華段；步道終點之一的太和村「湖桶底」。  整條路線除了有孟宗竹林與原始森林外，更隨季節變化，可以賞梅、桃、李、櫻花等，另外還有蕨類一百多種，動、植物生態極為豐富。沿途景點包括忘憂林、牛樟巨木、七步迴音谷、英雄坡、回頭嶺、望天崖等,0,0,1,0,0,0,0
安靖古道,安靖古道，於1772年七月完工。古道是由石階一階一階鋪成的，石頭乃是古石，從溪裡面撿起來，再加以鑿碎而製成的。 此古道是竹崎鄉的鹹菜甕及安靖村的居民通往梅仔坑的古道，鹹菜甕的居民越過觀音石山（海拔 1019公尺）的山腰，經詔安寮、坑仔、柿子寮、南靖抵梅仔坑，全長約10公里。 古梅樹是安靖的特殊景觀，已有三百年以上的樹齡，枝葉蔥鬱，拔地堅挺，須數人環抱，立於顛丘，千山萬壑，皆在腳下，遙望嘉義，西天雲彩或燈影閃爍的夜景，盡入眼中。,0,1,1,0,0,0,0
特富野步道,特富野古道原為鄒族人早年開闢的獵徑，日治時期古道後段改建成運送林木的「水山線」鐵路，至今仍留有許多鐵道遺跡。步道前段較為平緩，沿途遍植柳杉；後段則是陡下的枕木階梯步道，為闊葉原始森林，四季景觀變化多端，動植物生態豐富，是極佳的賞鳥步道。,0,0,1,0,0,0,0
嘉南大圳線-保鹿線-鹿義線-義布東線自行車道,保鹿自行車道自太保至鹿草，由水上台糖南靖休閒廣場舊鐵道設計完成，自行車道穿梭嘉南平原，沿途經163縣道、鹿草鄉公所、圓山宮、重寮安溪城隍廟、新發寺等景點，加上道路兩旁隨四季變換的油菜花、玉米、菱角、菠菜、馬鈴薯及稻田等田園景觀，適合闔家一起騎乘，騎累了還可至台糖南靖休閒廣場品味冰淇淋。,1,0,1,0,0,0,0
灣橋鐵道公園,灣橋地區為外來人口遷入眾多為人口密集地區，但相對地休憩空間較為缺乏，以阿里山小火車為特色，位於台159線竹崎灣橋路段旁的竹崎灣橋鐵道公園於96年10月22日完工驗收，由縣府移交竹崎鄉公所管理，提供社區居民一處休閒綠地。,1,0,1,0,0,0,0
鹿崛溝育菁親水公園,早期由先民挖掘引水灌溉農田之鹿堀溝，在大林鎮公所極力整治下，一改以往污濁面貌，沿構花木扶疏、景色宜人。漫步溝畔，微風徐徐，陽光投影於葉間，倒影於潭中，此美景不禁令人流連忘返。（資料來源：大林鎮公所),0,0,1,1,0,0,0
觀音瀑布,位於嘉義縣竹崎鄉文峰村的觀音瀑布，屬於朴子溪上游牛稠溪水系分支，瀑布從崖頂傾洩而下，形成一道垂直懸掛在崖壁上的長長白鍊，因遠觀狀似側身而立的觀音佛祖而得名，曾名列嘉義五景之一。九二一大地震之前，觀音瀑布曾是嘉義人郊遊踏青的熱門去處，但九二一大地震後瀑布崖壁崩塌，加上後來莫拉克風災導致由牛稠溪南岸溪心寮進入的道路中斷無法修復，使得觀音瀑布塵封了許多年。為重現觀音瀑布昔日風華，嘉義縣政府積極向中央爭取經費，並與阿里山國家風景區管理處攜手重建觀音瀑布園區與聯外道路，預定於110年底前開放，再現觀音瀑布旅遊勝地榮景，喚醒嘉義鄉親的美好記憶。,0,0,1,0,0,0,0
石棹琉璃光,琉璃光簡單來說算是雲海的一種，不過特別指在夜景時分，就是在有雲霧裊繞的夜景城市燈光透過雲霧的折射後，就像琉璃器皿透光後，顯現七彩迷濛般的色澤，因為底下需要有萬家燈火點綴，所以拍攝點必須在城市、小鎮附近，雲層不能太高或太厚、遠離城市。嘉義縣石棹地區，秋冬時節因地形及濕冷氣候影響，雲霧對流旺盛催生出如瀑布般壯觀雲海及七彩琉璃光等夢幻自然勝景，吸引眾多攝影愛好者來此等候夢幻美景。,0,0,1,0,0,0,0
1314觀景台,位於嘉義縣梅山鄉瑞峰村的海鼠山，是瑞峰地勢最高處，海拔高度為1311公尺，建於茶園中的觀景台本身高度為3公尺，相加起來剛好為1314公尺，「1314觀景台」象徵著「一生一世」的浪漫愛情宣言，還設有「1314愛情塔」，是超人氣浪漫約會打卡聖地，知名茶飲廣告曾在此拍攝地點，360度環景飽覽茶園風光，是觀賞阿里山日出的絕佳景點。,0,0,1,1,0,0,0
迷糊步道,迷糊步道位於嘉義縣阿里山鄉的樂野村，因連接米洋溪和湖底溪，鄒族村民取「米」、「湖」二字之諧音為步道命名，好記又饒富趣味。位於阿里山鄉公所旁，就是米洋溪步道入口，全長1.2公里，一座美麗而優雅的米洋吊橋靜靜的在溪谷上伸著懶腰，而步道就在吊橋的另一端輕輕召喚，好像隨時有樹仙子、花精靈會跳舞出來呢。沿途更有不少李樹，脆脆酸酸的李子味，真是透心涼。與福山古道交會處不難發現象徵鄒族生命繁衍與愛情的生命豆，另外這裡也是賞鳥的絕佳步道，如藪鳥、白耳畫眉、山紅頭、五色鳥等。,0,0,1,1,0,0,0
奮起湖杉林棧道,位於奮起湖的南端，步道口位於大型停車場旁，經百年土地公廟，高聳筆直的柳杉與台灣杉林夾道歡迎，青翠的竹林隨風搖曳，木棧階梯蜿蜒迂迴於樹林之間，沿途欣賞自然的生態景觀，聆聽蟲鳴鳥叫，享受天然的森林芬多精，自然純淨的環境，更成為稀有「雪螢」在此棲息，潺潺流水、清風陣陣，漫步其間洗滌塵囂，令人神清氣爽，步道平緩好走，途中設有公廁、拱橋、涼亭等，適合全家人郊遊散步。出口接至奮起湖老街「下腳店仔」，古樸老房林立的巷弄，是許多電影拍攝的場景，有如穿梭於時空廊道之中，可順道參觀奮起湖文史陳列室，瞭解奮起湖的前世與今生，欣賞百年肖楠木林，再一路逛至奮起湖老街、火車站，銜接北端的奮起湖步道。,0,0,1,1,0,0,0
同心橋,同心吊橋位於嘉義縣大埔鄉，銜接大埔鄉情人公園及湖濱公園，同心橋的橋門架以「雙人」為造型，象徵串連人與人間的距離。,0,0,1,0,0,0,0
隘寮河堤車道,隘寮溪河堤車道東起隘寮、南至九如，共分為隘寮、鹽埔、里港、九如四個區段，全長約24公里，視野遼闊可展望遠處，沿途可一路欣賞隘寮溪河岸風光，還有當地居民認養的綠色長城，公園、里港老街、佛光山與斜張橋。路面平坦的隘寮溪河堤車道沿途設有路障禁止汽車通行，路標與指示牌也都設立的十分清晰，為方便民眾休息，更在定點設立涼亭和景觀地圖，是一條非常適合健行的自行車道。,0,0,1,0,0,0,0
長治-麟洛自行車道,長治-麟洛自行車車道是全國第一條國道單車道，由屏東國道三號高架橋下的道路開闢整修而成，全長為10.5公里，以客家文化為特色，並且配合車道附近的景點設置了藝術造景，讓人耳目一新。沿路有運動公園、六堆客家園區、溼地公園等景點，都可停下來參觀，是一條安全又有休閒娛樂的自行車道，適合一般大眾攜家帶眷在此騎車及紓解壓力。,0,0,1,0,0,0,0
運動公園,位於屏東縣麟洛鄉的運動公園，佔地寬廣，種植了多樣花草樹木，設立了許多遊樂設施和運動設備，還有一座專門為單車族而設立的景觀橋，景致優美且路線輕鬆安全，非常適合親子進行單車休閒活動，公園裡面不只提供了運動的場所，還擺設了許多公共藝術品，讓民眾藉著欣賞這些藝術品提升人文素養，另外，公園內的露天演藝廳，可以舉辦各種藝文活動和交流活動，每到假日，總是有許多親子會來此地散步運動，迎著舒適的微風，享受休閒時光。,0,0,1,1,1,0,0
麟洛自行車道,麟洛自行車道是一條短而美的單車路線，雖然只有3.5公里，沿路風光卻總讓人深印腦海。騎乘在寧靜的車道上，沿途不時出現綠蔭扶疏的景象，像是紅磚砌築的矮牆上，可能爬滿了馬櫻丹或九重葛，經過一段路，轉眼又是一列列的農田景色，繼續前行，一盆盆嬌豔的花朵即在風中展露丰采；而附近的開臺聖王廟、濕地公園、六堆客家文化園區，也別忘了停下腳步、細心欣賞。,0,0,1,0,0,0,0
濕地公園,屏東縣麟洛鄉麟東橋至隘寮營區東側的「上麟洛溪」，屬於隘寮溪流域，水源來自終年豐沛的地下伏流水，原是麟洛唯一無污染中流程最長的河段，東側有臺糖隘寮溪農場，流域內的窪地、沼澤孕育了豐富的水生物種，河川生態豐富。麟洛人工溼地便是在上麟洛溪、臺糖隘寮溪農場旁設置的2.8公頃人工溼地，引取隘寮溪灌溉水渠的污水淨化，亦提供了民眾環境教育與休閒遊憩的空間。,0,0,1,0,0,0,0
萬金綠色隧道,萬金綠色隧道位於萬金村通往萬金營區的道路兩旁，種滿尤加利樹與桃花心木，總長約一公里，與臺糖甘蔗園規畫種植的樹木相互輝映，清晨陽光透過枝葉灑在道路上，當樹葉隨風搖曳，形成變化萬千的光影，讓人彷彿置身夢境般美麗。,0,0,1,1,0,0,0
大鵬環灣車道,背起簡單的行囊，踏著單車，開始一趟屬於個人的單車環島行，大鵬灣國家風景區提供環灣自行車道整合「潟湖景觀」、「漁村風情」、「社區人文」、與「自然景觀」、「海堤夕陽」等五大特色，較其他各大都市之「都市自行車道」系統更為優越，更具觀光價值。環灣自行車道全長約16.4公里，騎乘繞行一週約2小時，沿途行經港灣大道段、嘉蓮社區段、漁村風光段、夕陽海堤段、紅樹林段與溼地段等。週休假日，換上輕便裝備，騎著腳踏車，進入大鵬灣，展開一趟知性之旅，往紅樹林溼地與一望無際百畝漁塭踏去，眺望整座大武山脈，躍上海堤欣賞夕陽，慢活無比。,0,0,1,0,1,0,0
竹田自行車道,竹田自行車道沿著鐵路所闢建，全長約44公里，是一條可與火車並肩而行的自行車道，由西勢車站開始，沿徒經過許多觀光景點，如客家文物館、六堆忠義祠、竹田驛園，騎在單車道上偶爾還會遇到火車行經身旁，火車隆隆的聲音及因為行進吹起的陣風，讓人感到別有一番風味。,1,0,1,0,0,0,0
屏北部落自行車道,瑪家派出所 - 三地門藝術村 - 中山公園 - 地磨兒公園 - 三德檢查哨 - 伊拉瀑布群 - 霧臺山胞部落觀光農村 - 霧臺分駐所 - 霧臺岩板巷。自行車道從三地門到霧臺鄉，欣賞排灣族和魯凱族的原鄉風情。,0,0,1,0,0,1,0
高樹-三地門自行車道,高樹-三地門自行車道可進入養生之鄉高樹鄉享受客家風情及享受高樹鄉的好山好水。路程為：沿山公路 - 大路觀主題樂園 - 石獅公園 - 順天宮石獅 - 武陵橋 - 高樹分駐所 - 菸樓 - 三山國王廟 - 舊寮派出所 -峰雷宮 - 阿嬤的洗衣場 - 花炫河堤 - 尾寮山步道 - 天動寺 - 大津瀑布 - 津山休閒農園 - 嘉賽營地 - 嘉賽樂園,0,0,1,0,0,0,0
笠頂山登山步道,笠頂山海拔僅 659 公尺，共有三個登山入口，而由佳義國小後門進入之步道平坦而開闊，沿途密佈芒果樹與相思樹，方便停車，是大部份登山客開始之處。另一條較具難度的步道在佳義派出所旁，本是原住民獵徑，沿途陡坡連綿，坡度平均在四十度以上。笠頂山因為外型像斗笠而得名，若天氣晴朗可遠眺整個高屏平原，每逢假日來自市區登山者擠滿山道，山路難度適中，很適合都會人口前來健行健身。,0,0,1,0,0,0,0
山林自行車道,從三地門大橋，經內埔農工 - 吉貝木棉林，沿185線道 - 泰武派出所 - 萬金天主堂 - 萬金林蔭大道 - 涼山瀑布 - 內埔農工 - 原住民民族文化園區，沿途經過瑪家、泰武和來義等排灣族鄉，可以欣賞瀑布、山林和排灣族舊部落等景色。,0,0,1,0,0,0,0
竹林生態溼地公園,屬於碧雲寺觀音嬷管轄範圍的竹林生態溼地公園，就在碧雲寺前方的木棧道往下走。走下一道長長的階梯後，會先經過龍目水，隨著龍目水往下流，是一片濕地公園，每到蓮花盛開的季節，湖面上盡是優雅的蓮花成群。而整個濕地公園被竹林環繞，涼風吹拂過來，竹影隨風搖曳，光影交織成一片翠綠，在這一片綠光中散步起來格外舒暢！,0,0,1,1,0,0,1
枋寮自行車道,路線經枋寮漁港→F3藝文特區→水底寮古厝群→綠色碼頭→李家古厝→石頭營敬字亭,0,0,1,0,0,0,0
浸水營古道(枋寮段),"浸水營古道西起屏東縣枋寮鄉水底寮，穿越過中央山脈稜線後，東止於臺東縣大武，古道全長47公里，海拔最高處為1,300公尺。沿線區內有「浸水營闊葉樹林保護區」、「大武臺灣穗花杉自然保留區」及「大武臺灣油杉自然保護區」三大保護區，極具植物地理學內涵與研究價值，非常適合生態及深度之旅。    清道光年間，臺灣西部平埔族曾利用這條路，集體移民到東部後山的卑南（臺東）一帶，至清光緒八年（1882年），重新拓修為開山撫番道路，定名為「三條崙道」。到了日治時期，經日本人修改為聯絡西部屏東枋寮與東部大武的警備道路，遂改名為「浸水營越嶺道」。    而浸水營古道上現存的人文遺址包括「姑仔崙舊社」、「出水坡遺址」、「浸水營清代營盤址」、「浸水營日警駐在所」，都是珍貴的史蹟；值得一提的是，胡適的父親胡鐵花於清光緒十八年曾在臺灣任職臺東知州時，當時便是利用這條古道過去臺東述職的。    數百年來，浸水營古道歷經荷蘭、日本、民國時代，成為當時的荷蘭人、卑南族、排灣族、平埔族、漢人、日本人最便捷的越嶺道路，對於從事巡視、傳教、商業交易、移民、郵遞、健行、學術研究等助益甚多，是臺灣歷史上使用年代最悠久、最具代表性、使用率最高的步道。",0,1,1,0,0,0,0
力里登山步道,力里山海拔1170公尺，為三等4249號三角點。登山口自大漢林道11.5公里處之舊力里社起登，腳程快約 50 分鐘到山頂三角點峰。力里山登山步道，是條有挑戰性的步道，山友們把力里山步道分成緩坡、好漢坡、圓峰、硬坡、尖峰、主峰，也就所謂的過五關。其中的硬坡名符其實，是最硬的一關，來走的山友要有心理準備。力里山登山步道的圓峰、尖峰、這兩段是視野最好的段，天氣許可，可看到北湖呂山。季節對了，滿山的紅紋鳳蝶，是一條景色豐富的登山步道。,0,0,1,0,0,0,0
里龍山步道,里龍山位於恆春半島的楓港段，是牡丹鄉與獅子鄉的界山，自成一列山脈，並有南里龍、北里龍相擁護衛，『中級山裡的百岳』，標高1062公尺，屬林務局國家森林步道，由其負責維護與管理，步道也增添專責機構的安全性，同時在盤根錯節的天然原始闊葉林裡，更蘊藏著冰河時期的珍貴稀有植物--臺灣穗花杉。在南部登山界具有崇高的地位，其氣勢與視野的遼闊，絕不輸給任何一座同等級高山，在屏鵝公路上，過楓港後抬頭印入眼簾的奇異山頭即為此山。登山口位於山腳的龍峰寺，途中更有二處小溪谷清澈見底，溪中還有許多溪棲的蝦蟹等生物，增添許多驚喜。北眺中央山脈南嶽北大武山，東攬太平洋的海天一線，南望墾丁優美的海岸線及熱帶風光，，懷抱著一顆一等三角點，收攏了遠望的極佳視野。,0,0,1,0,0,0,0
水蛙窟,水蛙窟位於風吹砂與鵝鑾鼻公園之間的一個小村落裡，除了水蛙窟的池景，周圍盡是一大片綠油油的草原，景色看來優美恬靜。在早年，這裡的水源相當豐沛，潭水比現在所見還要深廣，加上棲居在水窟一帶的蛙類很多，每到夏季或者下雨過後，就可以聽到蛙聲齊鳴不絕於耳，所以取名為「水蛙窟」。但是每一個自然景觀的消失，好像都逃不了人為破壞的因素，自從30年前闢建佳鵝公路時，開路所挖起的砂石長期往附近傾倒的結果，造成水蛙窟逐漸被填蓋，加上池水慢慢乾涸，使原本棲息於此的水蛙數量與種類都大幅減少，幽靜的池景沒有了，可愛的青蛙也不見蹤影，水蛙窟美景從此凋零。為了恢復水蛙窟昔日「蛙鳴不絕」的盛名，近年來當地居民與墾管處遂展開復育計畫，首先是引進水源，打造一處自然生態溼地，以作為各類生物的棲息地，另外在水蛙窟周邊種植水生植物，豐富生態環境復育的條件，使蛙群重返水蛙窟，讓蛙聲響亮再現。再者，擬定水蛙窟人文生態之旅計畫，規劃出適當的旅遊路線，並訓練在地解說義工，以最具說服力的身份，帶領遊客認識水蛙窟社區的歷史人文，參觀池邊自然生態，以及徜徉青綠蒼翠的牧草原，運氣好的話，還能與梅花鹿、小雲雀來個不期而遇。來到水蛙窟，等於享受一趟深度的人文暨生態旅程。,0,0,1,1,0,0,0
內文部落,內文部落位於楓港溪上游左岸，楓港溪與里仁溪分水嶺西方約1公里的地方，分為內文一巷、內文二巷、及內海三個部落。內文部落過去由四個聚落組合而成，原居住在枋山溪支流內文溪左右岸，是一個歷史悠久、勢力龐大的部落，具有相當重要的地位。不過光復之後，因原址不利農業，民國37年間村民公議遷村事宜，自37年4月至39年10月間，分批移住。除大部分移至現址外，部分族人遷往現在楓林、內獅、獅子、牡丹、南世等村，兩大頭目家族也分別遷至牡丹鄉東源村及獅子村中心崙部落。內文部落位於深山中，仰賴南迴公路對外聯絡，交通不便，青壯年大多外出謀生，部落裡僅剩老人與小孩。受氣候影響，本村附近有濕地、沼澤與雨林等熱帶才有的地形，是為一大特色。,0,0,1,1,0,0,0
壽峠林道,「壽峠林道」上的壽峠檢查哨位在屏東與臺東交界，廢棄多年後，近年來成為單車族環島路經南迴公路必經的地點，檢查哨牆面及附近大小路牌也被鐵馬族到處簽名，成為壽峠路段的特殊景象，沿著壽峠旁的199縣道往內文、牡丹方向騎乘，可以看到兩旁青翠筆筒樹及滿地野薑花美景，沁涼的林道微風，讓鐵馬族們大呼不虛此行。,0,0,1,0,0,0,0
哭泣湖畔自然生態園區,屏東縣牡丹鄉的東源部落，以豐富的濕地生態著稱，部落裡的水上草原與東源湖，更被登錄為國家重要的濕地，而由部落的董實牧師夫婦經營的「哭泣湖畔自然生態園區」，便位於這個得天獨厚的生態教室。風趣的董牧師也常化身為解說員，用自己的生活經驗與對生態的研究，帶領遊客一探東源湖豐富的生態，分享與大自然共存的道理。園區內亦設有民宿，提供住宿服務與風味餐，讓來到這裡旅遊的遊客，不僅可滿足對生態的好奇，更能品嘗道地的原住民餐點。,0,0,1,1,0,0,0
