name,description,0,1,2,3,4,5,6
北回歸線,台灣一共有三個北回歸線標，分別在嘉義水上鄉、花蓮舞鶴台地、豐濱鄉，而這座北回歸線標碑位於台11線70.5公里處。潔白的地標坐擁海岸山脈與太平洋的美景，常常吸引了許多遊客來此拍照、休憩，但是你知道為什麼這座北回歸線標碑中間會有一條細縫嗎？北回歸線就是指北緯23.5&deg;，象徵著熱帶以及亞熱帶的分界點，最明顯的就是台灣北回歸線以南主要種植的作物，為熱帶的鳳梨以及釋迦，以北主要的作物就是溫帶作物茶以及水稻，而夏至中午時陽光會正好射入北回歸線標的縫中，此刻，塔旁的遊客即可體驗太陽下無影子的奇觀！所以經過除了來此拍照做個紀念，也可以閱讀解說牌了解四季的奧妙！,0,0,1,1,0,0,0
哈巴狗與睡美人岩,海參坪位於綠島東部海岸之中段的海灣，由於礁岸地形以及海水沖蝕作用，因此奇岩密佈、風景秀麗，吸引不少旅人前來探訪，走上有「小長城」之稱的步道，到觀海亭看著潔白的海浪沖刷著珊瑚裙礁月形海灣，或是眺望睡美人岩與哈巴狗岩，由綠地、沙灘、海灣、藍海組成的美景，讓人難以將目光移開，不斷讚嘆大自然的巧手，並留下片片美好的回憶。小長城步道長度：400公尺步行時間：來回約20分鐘小長城步道建在海參坪北側山坡上，沿著山稜蜿蜒而上的石階步道，遠看有如縮小版的萬里長城，走在這步道上，環顧四週美景，令人心曠神怡。而在海參坪的南方的海崖下，有一個獨立的海蝕柱，遠遠望去像是孔老夫子正面壁思過，因此名為「孔子岩」。,0,0,1,0,1,0,0
樟原,「樟原」位在台東縣東海岸最北端，東濱太平洋、西倚東海岸山脈、南鄰八仙洞、北承長虹橋，依山傍水，風景秀麗。當地居民以阿美族群居多，多數以務農、雜工、捕魚為業；民風純樸，生活勤儉。樟原村最具特色地標為「樟原基督教長老教會」，是阿美族樟原部落學習諾亞造方舟的精神，居民主動奉獻集資，並以義賣、賣野菜、抓青蛙等方式，自行設計興建完成一所教會，此建築物被譽為台灣最美之「諾亞方舟」造型教堂；建築體兩側有圍矮牆環繞，猶如船隻駛進樟原港口正要靠岸，守護著當地居民；外牆鮮明的紅磚部落圖騰，象徵在地部落原鄉精神永為流傳。另外，在樟原村南端的「樟原橋」，共有老、中、新三座橋，平行排列橫跨在水母丁溪上，因為地勢高低不一，形成特殊的景觀，交通部觀光局東部海岸國家風景區管理處也在此設置「樟原橋休息區」，遊客佇足在新橋上，欣賞卵石砌成的舊橋，圓拱型橋身橫跨著溪谷，展現古樸風情的自然景觀。,0,1,1,0,1,0,0
美山驛站,東海岸沿線因為風景秀麗，是許多單車族的最愛。「驛站」的設置，便是為了服務廣大的單車愛好者，於東海岸沿線提供補給、休憩、餐飲、單車維修等複合式場所。美山驛站與台東縣成功鎮農會展售中心位於同一處，驛站兩側依山傍海處，每年春季有成功鎮農會舉辦之成功花海，美麗的各色花朵搭配創意的漂流木裝置藝術，讓行經東海岸的遊客們又多一處賞玩的景點。同時，美山驛站設有三層樓高之觀景涼亭，從涼亭上可眺望不同角度之三仙台景觀，是欣賞東海岸景觀絕佳的私房景點之一。,0,0,1,0,1,0,0
成功海濱公園,成功濱海公園鄰近三仙台，位於成功新港漁港的東北方，是當地居民散步、騎單車的好地方，也是單車族騎車遊東海岸休息的中繼站。成功濱海公園串聯了三仙台、新港漁港、成功海洋環境教室、台東海洋夢想館與比西里岸等景點，並結合賞鯨、環境教育、生態及部落深度導覽、自行車運動、迎曙光、草地音樂會等多樣遊憩活動。成功濱海公園全區打造無障礙友善旅遊環境，讓旅人可以悠閒騎著單車，一路暢遊東海岸，累了，就到這兒休息，眺望三仙台的美麗海景。,0,0,1,0,1,0,0
龍埕,「龍埕」為一段長達600公尺內曲、南向之凝灰岩與玄武岩互層的地形地質，並經過千百萬年的海蝕作用後形成平整的海蝕平台。由於熔岩流在流動覆蓋過程受到營力互相擠壓後，形成動感十足的褶皺現象，加上不同種類的藻苔色澤強化褶皺曲線條紋的立體感。由崖錐頂上俯瞰平台，可見綠、白、灰、褐之曲線蜿蜒其上，整體看來宛若一條翻騰在藍天碧海中的蟠龍，因此得名「龍埕」。廣義的龍埕泛指該處三大片的連續海蝕平台而言，鄰近的小海蝕平台所在位置，猶如龍珠、龍頭，活靈活現，渾然生成。從高處往下望，因大浪拍擊平台邊激起之浪花，又彷彿白龍在浮游。從大獅風景區觀景台可見收全景，亦可經由涼亭旁沿著海岸人工石階道前往另一觀景台欣賞。循緩降鈄坡往下走，可抵達海蝕平台，可近距離觀察豆腐岩、壺穴等地質景觀。,0,0,1,0,1,0,0
天台山,海拔53公尺的天台山岡丘草原帶為望安島之最高峰，附近是澎湖著名文石產地，山四周草原平坦，偶有牛羊漫步，美景自然天成。天台山已成為眺望望安本島和對岸花嶼最佳的景點。天台山岩層主要為微輝長斑岩塊，其節理成片狀。西側海崖下有壯觀的玄武岩景觀，依循步道下至西邊海岸，可發現一處高達30公尺海蝕洞奇景，微輝長斑岩的節理之美與虎井、桶盤兩島之柱狀玄武岩景觀不同，天台山片狀交錯的節理形成美麗的「石花」。,0,0,1,0,1,0,0
鳳凰山莊(賽斯村),環境清幽的鳳凰山莊(賽斯村)，位在客家庄鳳林鎮西側鳳林溪上游地區，擁有露營區、烤肉場等設施，並也提供旅人住宿、購物、享用餐點，週邊青山環抱、溪水潺潺，臨近鳳凰瀑布與鳳林溪，十分適合來一趟自然生態旅遊。鳳凰山莊原本是鳳林地區的水源地，水質清澈甘甜，並擁有原始的自然風貌，伴著鳳林溪潺潺流水，跟著標示往山邊前進，可以看見秀麗的鳳凰瀑布，猶如一條銀絲帶般懸掛於10公尺高的山壁上，空氣間瀰漫著負離子，清淺的水潭冰涼透徹，是一處極富野趣的遊憩勝地，因此鳳林鎮公所早年將此區規劃為鳳凰瀑布風景區，為炎炎夏日帶來一絲沁涼。在花東縱谷國家風景區成立後，便將此地規劃為發展自然生態旅遊與心靈探索的遊憩區，利用鳳凰山莊原有的建築，增設露營區、烤肉場及其他相關設施，而賽斯村每月都有規劃各種的心靈探索活動，希望為造訪花東縱谷的旅人，提供另一種不同風格與型態的活動選擇。,0,0,1,1,0,0,0
瑞穗泛舟服務中心,說到花東地區的水域活動，最具知名度也最刺激的非「秀姑巒溪泛舟」莫屬了。在民國70年代，秀姑巒溪就已成為國內泛舟活動的首選之地。每到夏天泛舟旺季，從瑞穗大橋至長虹橋，全程24公里的泛舟河段上，只見一艘艘紅艷艷的橡皮艇將整段河道妝點得綺麗動人。20多處難度不一的激流與險灘，帶給泛舟遊客充滿驚險與刺激的難忘旅遊經驗，而秀姑巒溪沿途的峽谷與奇岩等自然美景，無不烙印在泛舟客的心頭，久久難以忘懷。沿著溪畔繞山而行的瑞港公路上，更有數不清的廂型車，來回穿梭於兩地之間接駁載客。東海岸國家風景區管理處在瑞穗大橋南側的秀姑巒溪畔，設立了瑞穗泛舟服務中心。在這棟仿原住民傳統建築外觀的服務中心裡，除了介紹秀姑巒溪泛舟河段的生態資源、提供遊客泛舟相關資訊、播放泛舟安全影片之外，還附設有露營區。在泛舟活動季節裡，為遊客提供最完善的服務。,0,0,1,0,1,0,0
北回歸線標誌公園,北回歸線標誌公園位在瑞穗舞鶴台地，白色日晷造型的北回歸線標誌，是旅客經過舞鶴台地時必拍照的景點，而公園內周遭設有巨大茶壺造型的裝置藝術、廁所、休憩區，在公園兩側的木製迴廊中，設有許多跟天象、氣候、節氣、地球科學等相關的解說牌示，夏日時這裡還會舉辦夏至235的活動，吸引人潮前來探訪吃美食、看表演。北回歸線為紀錄太陽在北半球所能直射到距離赤道最遠的位置，位在北緯23.5度。每逢夏至的那一天，太陽就直射在北回歸線上，正午時分的「立竿不見影」，更是北回歸線上的獨特天象。在臺灣一共有3處設置北回歸線標誌，分別在嘉義水上鄉、花蓮瑞穗鄉、豐濱鄉。其中位在瑞穗的北回歸線標誌設立於1933年，放在瑞穗火車站的西側，爾後因東線鐵路拓寬才遷於現址。不過，北回歸線通過台9號省道的確實地點，其實是在目前北回歸線標誌以南大約兩公里的地方。,0,0,1,0,0,0,0
羅山遊憩區,羅山遊憩區以泥火山景觀、手工豆腐、羅山瀑布聞名，來到羅山遊憩區，不僅可以親自體驗用泥火山的滷水來製作豆腐，還能到附近的羅山大魚池眺望羅山瀑布，沿著步道走則可欣賞泥火山的奇觀與特有的濱海植物，感受大自然的奧妙。羅山瀑布為海岸山脈斷層地形所形成的一個瀑布，高約120公尺，分上下兩層，水量豐沛，氣勢驚人。從遠方眺望可看見羅山瀑布猶如一道細細的銀鍊，懸掛在青翠的山壁之間，再向西眺望花東縱谷平原，羅山有機村純樸的田園風光更是一覽無遺。在羅山瀑布附近的泥火山，當地人稱為「鹽坪」，噴出來的泥漿不但含有瓦斯，同時也帶有鹹味。因此羅山村的居民們，很早就知道收集從泥火山噴出來的瓦斯做為燒水煮飯的燃料，也利用泥火山的滷水製作手工豆腐，做出來的豆腐口感綿密、紮實，成為來羅山必品嘗的一道美食。,0,0,1,0,0,0,0
霧鹿峽谷,"大S型的峽谷，色彩斑斕的岩壁，蜿蜒清澈的霧鹿溪湍急而下，雄偉壯闊的峽谷景觀媲美太魯閣國家公園，這裡就是南橫八景之一的霧鹿峽谷。陡峭的峽谷景致，深深吸引國外內的山林愛好者前來尋幽訪勝，走在天龍吊橋上觀賞氣勢磅礡的霧鹿峽谷，或是到霧鹿砲台了解抗日歷史，再去六口溫泉泡腳、碧山溫泉泡湯，感受山林間寧靜悠遠的氛圍。走在南橫公路上經過霧鹿峽谷時，不時可見下方溪谷岩縫中，噴出氤氳裊裊的水蒸氣，滾燙的溫泉從山壁夾縫中湧出，泉水中的礦物質在峭壁上留下黃、棕、黑、墨綠等多種色彩的水紋，猶如一幅幅渾然天成的壁畫，令人驚艷萬分。如此豐富的溫泉資源，讓人可在霧鹿峽谷中溯溪挑戰泡野溪溫泉，或者到旅館泡湯，享受冬日泡湯的樂趣。橫跨霧鹿溪的天龍吊橋，全長110公尺，寬度不到1.5公尺，連接峽谷兩側的崖壁。天龍吊橋曾是日治時期開闢的「關山越嶺古道」，從南橫公路上步行過了天龍吊橋後，沿著當地人整建出來的古道，進行一趟健行之旅。古道全長約1,089公尺，再接上南橫公路，那裡是俯看霧鹿峽谷絕佳視野的好地方。",0,0,1,0,0,0,0
山里車站與山里教堂,宛如與世隔絕的小小車站，坐落在三、四十幾戶的山里部落中，鮮少有人知道的山里車站，每天看著對號列車呼嘯而過，在作家劉克襄的筆下是一座「傳說中，到不了的車站」。孤寂而寧靜的山里車站，四周錯落幾處農田，在鐵路電氣化後依然服務每日為數不多的旅客，車站中的島式月台仍保持在東線鐵路拓建以前的風格，靜謐純樸的氛圍，加上作家的文章，深深吸引不少旅客與鐵道迷前往探訪這一座美麗的小車站。而在山裡車站附近的山里教堂，斑駁白色石牆的外觀，屋頂插著帶有滄桑感的紅色十字架，刻畫出歲月流淌的痕跡，如此小小一座教堂卻是當地的信仰中心，隨著山里車站爆紅，矗立在部落中的山里教堂，也變成遊客爭相拍照的景點，為安靜的山里部落帶來幾分熱鬧活潑的氣息。,1,0,1,0,0,0,0
雲山水植物農場,自從黑松汽水來這拍攝廣告後一炮而紅的雲山水，有著絕美宛如歐洲明信片上的風景，翠綠的落羽松林倒映在水中，隨著陽光灑落而呈現夢幻的光影變化，加上附近充滿童趣、像城堡般的民宿，讓人彷彿置身於國外，在一旁遼闊廣大的青青草地，更是能讓小朋友盡情奔跑，享受快樂的親子時光。到了春分時刻，栽種於夢幻湖畔的鳶尾花紛紛綻放，柔和的紫色花朵隨風在水岸旁蕩漾；秋分時節，走在小水壩上的石磚步道，聽著潺潺流水聲，欣賞眼前由綠轉黃而變得繽紛多彩的落羽松林，讓人情不自禁地沉浸在這水中森林的風景中。若是想要隨時隨地欣賞雲山水的美景，不妨來此居住一晚，看著清晨雲煙繚繞的山巒與湖畔相互輝映，或是正午艷陽高照為落羽松林鍍上一層層金光，享受雲山水獨有的歐洲風情。貼心小提醒：凡進入雲山水園區皆會收取入園費喔！,0,0,1,1,0,0,0
東里車站與東里鐵馬驛站,每天平均約20人進出的東里車站，看似不起眼，卻被譽為「山線最美的車站」，一走進月台便被眼前的美景所吸引，整片無邊無際的綠色稻田映在眼前，小小的東里車站被圍繞在田野間，壯觀令人驚呼不已的田園景緻，深深吸引不少遊客前來探訪。東里鐵馬驛站前身為舊東里車站，也是玉富自行車道北上的起點，兩旁無垠的阡陌景致，是許多自行車友必拜訪站點之一，而東里鐵馬驛站中仍保留早期月台的風貌，舊時的復古情懷，加上花東縱谷的招牌景色，讓人能夠邊騎自行車邊欣賞田園美景。當太陽升起，陽光灑落在稻田上，翠綠的秧苗隨風搖曳，一波波綠色稻浪映入眼簾，再隨著季節變化，稻田由綠轉黃，空氣間瀰漫著稻香，騎著單車經過兩旁隨風搖擺的金色稻浪，細細感受東里車站與東里鐵馬驛站的靜謐與稻田的絕美風景。,1,0,1,1,0,0,0
玉富自行車道,長約10公里的玉富自行車道，為「亞洲唯一‧世界唯二」橫跨兩個板塊的自行車道，起點從玉里到富里的東里鐵馬驛站，沿途視野十分遼闊，兩旁伴隨著無垠的阡陌景觀，騎在舊鐵道改建的車道上，經過橫跨歐亞大陸板塊與菲律賓海板塊的秀姑巒大橋，享受腳跨兩個板塊的驚奇感！玉富自行車道前身為從玉里到富里的舊東線鐵道，因受到歐亞大陸板塊與菲律賓海板塊擠壓的緣故，每年約長高2-3公分，因此2007年臺鐵改線之後，這條舊鐵道改建為玉富自行車道，成為獨一無二會長高的自行車道。坡度平緩、景色宜人的玉富自行車道，不僅適合親子出遊騎鐵馬，也是在地人運動的好地方，讓人欣賞隨著四季變化而有所不同田園的景觀。玉富自行車道路線圖,0,0,1,0,0,0,0
武陵綠色隧道,武陵綠色隧道位在台九線武陵段，全長約4.5公里。沿路兩旁的樟樹、小葉欖仁和木麻黃林蔭遮蔽，偶爾抬頭可見天空有著繽紛的飛行傘翱翔，是相當迷人的綠色隧道，每逢雙數的週六便會舉辦2626市集，成為許多人前往拜訪、逛市集的好地方。來到武陵綠色隧道，看著陽光灑落樹葉間，徐徐涼風吹拂，再加上來往的車輛少，最適合躺在林蔭遮蔽的馬路上或騎鐵馬，感受有別於都市忙碌生活的慢步調。除此之外，道路兩旁有著許多特色店家，而在雙數的週六下午2點到晚上6點舉辦的2626市集，販售各種農特產、小點或文創手作品，時常吸引旅客目光，是武陵綠色隧道最有特色的活動。,0,0,1,0,0,0,0
吉利潭,四周青山環繞，一汪清潭宛若山間明月，帶點中國風的拱橋倒映在水面上，走在環潭步道上欣賞眼前美景、認識水中生物，為旅人帶走都市的喧囂，這就是隱藏在光復馬錫山下的山中秘境──吉利潭，也是花蓮近期新興景點，擁有戲水道、生態浮島等設施，為炎炎夏日親子戲水、踏青與認識自然生態的好去處。吉利潭原本是日治時期遺留下來的儲木池，上游源自一處有三層的瀑布，大小潭蓄滿了清徹的山泉水，是雙色澤蟹、拉氏清溪蟹、菊池氏細鯽等原生動物的棲地，也是光復鄉阿美族的戲水秘境與祈雨聖地。隨著伐木業沒落而荒蕪的吉利潭，經過整治、美化後，成為認識自然生態的親水公園，站在橋上聽著潺潺流水聲，或是在涼亭遠眺馬錫山、與親朋好友話家常，清幽的環境是來光復必訪的景點之一。,0,0,1,1,0,0,0
東華大學,東華大學西依巍峨的中央山脈，東臨連綿不絕的海岸山脈，諾大的校區擁有青青草地、歐式風格的建築與三座絕美的湖畔──小華湖、華湖及東湖，其中以東湖最富盛名，波光瀲灩的湖景搭配歐風建築和遠方蒼綠的山巒，宛若明信片上的風景，成為旅人或新人拍婚紗照的經典拍攝地，而遼闊的草地更是毛小孩追逐嬉戲的天堂。帶點花東獨特的悠閒步調，那湖光山色的風景，讓東華大學成為花蓮最美的校園，走在綠蔭遮蔽的步道中，不時可見莘莘學子結伴而行，搭配六月鳳凰花開的季節景致，構成一幅交織人文自然美景的畫作。當夜晚降臨時，屬於東華大學的隱藏版美景才正要上演，躺在草地上欣賞滿天浩瀚無垠的星空，可是學生專屬的獨特體驗呢！,0,0,1,1,0,1,0
環灣自行車道,背起簡單的行囊，踏著單車，開始一趟屬於個人的單車環島行，大鵬灣國家風景區提供環灣自行車道整合「潟湖景觀」、「漁村風情」、「社區人文」、與「自然景觀」、「海堤夕陽」等五大特色，較其他各大都市之「都市自行車道」系統更為優越，更具觀光價值。 環灣自行車道全長約16.4公里，騎乘繞行一週約2小時，沿途行經港灣大道段、嘉蓮社區段、漁村風光段、夕陽海堤段、紅樹林段與溼地段等。週休假日，換上輕便裝備，騎著腳踏車，進入大鵬灣，展開一趟知性之旅，往紅樹林溼地與一望無際百畝漁塭踏去，眺望整座大武山脈，躍上海堤欣賞夕陽，慢活無比。,0,0,1,0,1,0,0
鵬灣跨海大橋,大鵬灣國家風景區環灣道路大鵬灣域出海口處（青洲遊憩區旁）景觀橋於100年3月完工啟用通車，為全國首座配合帆船進出而設計的開啟式景觀橋，未來配合BOT遊艇港建設，開放大型帆船進出，發展國際級遊艇及海域遊艇活動，未來將進一步與高雄愛河觀光碼頭形成遊艇活動之「金三角」。 鵬灣跨海大橋全長為579公尺，橋寬30公尺，主塔高度距水面71公尺，鵬灣跨海大橋距水面最高達17公尺(水面跨距約70公尺)，開啟之跨距達20公尺，以滿足各類型遊樂船舶出入所需，其造型採單塔非對稱單面複合式斜張橋，是特殊三向度設計（有別於一般二向度橋樑造型），正看如鵬鳥啣物，側如彎腰少女，背似英文字母大A，活動橋面只需2分鐘，即可開啟75度仰角，每星期六日下午五點還有開橋秀觀賞；夜間搭配燈光照明，除了贊有優美的景觀意象外，並可作為海上作業船隻及從事遊憩活動船隻之地標。,0,0,1,0,1,0,0
七孔瀑布,七孔瀑布群位於恆春半島北方加都魯溪中，七層瀑布群層層相疊，加上濃密森林原始林相，是賞瀑溯溪、健行攀高，享受山野景趣的好去處。七孔瀑布群因高度落差頗大，瀑布溪水長期沖刷溪床，而形成深淺不一的池穴，當地人稱此潭穴為「孔」，故有「七孔」之稱。七孔瀑布的入口在200縣道的春興橋頭，經都興橋1號橋後，約2公里可以到達售票口，由步道往前走，約8分鐘後可見到第一層瀑布，高約10公尺，沿著石波瀉下，甚為壯觀，經過第二成瀑布後，就可見到第三-第五層連續瀑布景觀，繼續往前行可經第六層最後抵達第七層瀑布，探索整個瀑布約略30分鐘，尋訪此瀑布別有一番意趣。造訪七孔瀑布群之後，並可與附近的風景名勝佳樂水、風吹沙、墾丁沿海景點連成一線。,0,0,1,0,0,0,0
落日灣,早期大鵬灣周邊居民多以漁塭養殖為業，家家戶戶的取水管在地面上穿行蔓延，造成視覺景觀的紊亂與管理上的困擾。經過多方協調規劃後，重新整合排序養殖戶的管線，匯集於「共用取水池」共同取水，不僅解決了景點與管理問題，也多了一處遊憩與教育場所。沿著潟湖週邊規劃了自行車道及步道，是賞夕陽的最佳景點之一，無障礙設施完整，因此也適合推著輪椅、享受微風、在美麗夕陽餘暉中漫遊其間。 為了讓此處景點能更貼近大鵬灣觀光人文風情特徵，2014年特別辦理『徵名活動』，最後重新命名為「落日灣」。,0,0,1,0,1,0,0
映霞橋亭,大鵬灣自行車主路線系統在2k+500處轉入左岸濕地公園，因須穿越林邊大排，故興建一座專屬自行車及行人通行的橋樑。考量南台灣炙熱氣候因素，在橋上設計涼亭式雙斜具透光的屋頂、廊道Ｖ字型的木百葉，不僅降低對周邊動物的干擾，也提供遮陽避雨、賞鳥場所。涼亭全長35公尺，因造型為一長廊型亭台橫跨在橋上，遊客稱之為「橋亭」。橋亭的設計提供了自行車及行人動線的連結，也作為大鵬灣生態旅遊的重要集散點，橋體以鋼構及木結構構築，橋型設計發想借鏡於「麥迪遜之橋」的意象，希冀遊客與大鵬灣的生態環境有場美麗的邂逅。 從遠處眺望橋亭，猶如一只木船行駛於藍天綠林的水岸間，遊客環遊至此可於橋亭短暫停留，享受片刻無爭的自在及優雅的靜謐；讓光的軌道從橋亭頂篷流洩而下感受微風吹拂，感受與大自然共同呼吸，與大地一起脈動，與候鳥一起翱翔的生態之旅。,0,0,1,0,0,0,0
三孔橋,大鵬灣三孔橋的噴泉為全台唯一海水光雕噴泉。噴泉設置於120m之三孔橋中央，合計全長40m，共裝有120個噴嘴(最遠可噴10M)，利用抽水機(四組馬達)將灣域海水抽引上來，再噴灑於大鵬灣灣域水面，為新概念的噴泉。噴泉因夜間透過60組燈光照明形成形形色色的彩虹，在白天、晚上各呈現不同風情。 噴泉所噴灑出的水量，每分鐘可達7.2噸，白天把隨著噴泉所灑下的水波模樣而飄揚的柳樹枝與柳葉形象化，可製造出上百種的噴水景觀。 到了夜晚，以象徵積極與希望的彩虹顏色點綴，變化出華麗的景象。橋上所設置的60組照明設施呈現出彩虹光影，給予遊客另一種視覺享受。 水舞展演時段即日起調整為每日17:00至22:00整點。,0,0,1,0,1,0,0
壁山,登上馬祖第一高山眺望北竿全景海拔298公尺的壁山，已經是馬祖地區的第一高峰，只要登上壁山觀景台，就能夠眺望整個北竿島嶼的風貌。喜歡登山健行的遊客，可以選擇利用東向從塘岐村沿登山道路而上，或是自另一端連接上村至芹壁的兩條步道登上觀景台，長度較短，也較沒有太多高難度的坡段，約30分鐘即可登頂。站在山腰處的觀景台憑欄眺望，天氣晴朗時，視野非常遼闊，北竿機場、塘岐村、后沃甚至遠方無人島的大坵、小坵等地區風景盡收眼底，讓人讚嘆的壯麗景色，除了是攝影同好必拍的馬祖景點之一，更是拍攝北竿機場飛機起降的最佳拍攝點。備註：壁山上風勢強勁，騎乘摩托車務必多注意安全；部份地區仍為軍事用地，拍攝時，請盡量不要對準軍事景點拍攝，以免滋生糾紛。,0,0,1,0,0,0,0
樂道澳,駐地旁海岸線的山谷水庫 從環島北路高處可遠眺樂道澳水庫全貌，樂道澳水庫位於西莒島的北方，倒三角形頂邊左方約三分之一處，初為東北向、後轉北向的開放型山谷，谷口泥沙淤積，形成澳口，稱為嘮叨澳，因名稱不雅，後取其諧音名為「樂道澳」。 為解決西莒常年乾旱、島上水源短缺，居民鑿井取水仍不敷民生使用，因此軍方選定在此地區山谷築壩攔水，由駐軍官兵協助施工，是兼具民生、戰防及灌溉功能的水庫，集水區面積約12公頃。 如今樂道澳已成為居民欣賞海灣美景及附近山景的好地方，天氣晴朗時，環島北路解說牌處更是一個欣賞大陸河山及夕陽的極佳地點，而環島路沿途散布廢棄據點，有的崗哨旁築有階梯下至海岸，都是探秘訪奇的好去處。,0,0,1,0,1,0,0
